      1 0.000000000    192.168.1.2           192.168.1.1           TCP      74     51026 → 80 [SYN] Seq=0 Win=29200 Len=0 MSS=1460 SACK_PERM=1 TSval=1178665830 TSecr=0 WS=128
      2 0.000016436    192.168.1.2           192.168.1.1           TCP      74     44106 → 443 [SYN] Seq=0 Win=29200 Len=0 MSS=1460 SACK_PERM=1 TSval=1178665830 TSecr=0 WS=128
      5 0.001286345    192.168.1.2           192.168.1.1           TCP      74     52580 → 22 [SYN] Seq=0 Win=29200 Len=0 MSS=1460 SACK_PERM=1 TSval=1178665831 TSecr=0 WS=128
      6 0.001296800    192.168.1.2           192.168.1.1           TCP      74     52674 → 53 [SYN] Seq=0 Win=29200 Len=0 MSS=1460 SACK_PERM=1 TSval=1178665832 TSecr=0 WS=128
      7 0.001305614    192.168.1.2           192.168.1.1           TCP      74     51034 → 80 [SYN] Seq=0 Win=29200 Len=0 MSS=1460 SACK_PERM=1 TSval=1178665832 TSecr=0 WS=128
      8 0.001314378    192.168.1.2           192.168.1.1           TCP      74     46818 → 23 [SYN] Seq=0 Win=29200 Len=0 MSS=1460 SACK_PERM=1 TSval=1178665832 TSecr=0 WS=128
      9 0.001532883    192.168.1.2           192.168.1.1           TCP      74     49360 → 21 [SYN] Seq=0 Win=29200 Len=0 MSS=1460 SACK_PERM=1 TSval=1178665832 TSecr=0 WS=128
     10 0.001534992    192.168.1.2           192.168.1.1           TCP      74     57558 → 25 [SYN] Seq=0 Win=29200 Len=0 MSS=1460 SACK_PERM=1 TSval=1178665832 TSecr=0 WS=128
     11 0.001535397    192.168.1.2           192.168.1.1           TCP      74     39986 → 35 [SYN] Seq=0 Win=29200 Len=0 MSS=1460 SACK_PERM=1 TSval=1178665832 TSecr=0 WS=128
     12 0.001535702    192.168.1.2           192.168.1.1           TCP      74     51172 → 24 [SYN] Seq=0 Win=29200 Len=0 MSS=1460 SACK_PERM=1 TSval=1178665832 TSecr=0 WS=128
     13 0.001536008    192.168.1.2           192.168.1.1           TCP      74     50144 → 86 [SYN] Seq=0 Win=29200 Len=0 MSS=1460 SACK_PERM=1 TSval=1178665832 TSecr=0 WS=128
     14 0.001536316    192.168.1.2           192.168.1.1           TCP      74     50112 → 43 [SYN] Seq=0 Win=29200 Len=0 MSS=1460 SACK_PERM=1 TSval=1178665832 TSecr=0 WS=128
     16 0.002293243    192.168.1.2           192.168.1.1           TCP      66     52580 → 22 [ACK] Seq=1 Ack=1 Win=29312 Len=0 TSval=1178665832 TSecr=3551686543
     19 0.002316378    192.168.1.2           192.168.1.1           TCP      66     52580 → 22 [RST, ACK] Seq=1 Ack=1 Win=29312 Len=0 TSval=1178665833 TSecr=3551686543
     20 0.002344736    192.168.1.2           192.168.1.1           TCP      74     40486 → 41 [SYN] Seq=0 Win=29200 Len=0 MSS=1460 SACK_PERM=1 TSval=1178665833 TSecr=0 WS=128
     21 0.002353576    192.168.1.2           192.168.1.1           TCP      74     42828 → 87 [SYN] Seq=0 Win=29200 Len=0 MSS=1460 SACK_PERM=1 TSval=1178665833 TSecr=0 WS=128
     22 0.002361867    192.168.1.2           192.168.1.1           TCP      74     33152 → 94 [SYN] Seq=0 Win=29200 Len=0 MSS=1460 SACK_PERM=1 TSval=1178665833 TSecr=0 WS=128
     23 0.002370357    192.168.1.2           192.168.1.1           TCP      74     59086 → 93 [SYN] Seq=0 Win=29200 Len=0 MSS=1460 SACK_PERM=1 TSval=1178665833 TSecr=0 WS=128
     24 0.002379777    192.168.1.2           192.168.1.1           TCP      74     36478 → 84 [SYN] Seq=0 Win=29200 Len=0 MSS=1460 SACK_PERM=1 TSval=1178665833 TSecr=0 WS=128
     25 0.002388575    192.168.1.2           192.168.1.1           TCP      74     52042 → 15 [SYN] Seq=0 Win=29200 Len=0 MSS=1460 SACK_PERM=1 TSval=1178665833 TSecr=0 WS=128
     29 0.002573539    192.168.1.2           192.168.1.1           TCP      74     55498 → 76 [SYN] Seq=0 Win=29200 Len=0 MSS=1460 SACK_PERM=1 TSval=1178665833 TSecr=0 WS=128
     30 0.002582785    192.168.1.2           192.168.1.1           TCP      74     52166 → 55 [SYN] Seq=0 Win=29200 Len=0 MSS=1460 SACK_PERM=1 TSval=1178665833 TSecr=0 WS=128
     31 0.002590901    192.168.1.2           192.168.1.1           TCP      74     38492 → 91 [SYN] Seq=0 Win=29200 Len=0 MSS=1460 SACK_PERM=1 TSval=1178665833 TSecr=0 WS=128
     32 0.002599209    192.168.1.2           192.168.1.1           TCP      74     46862 → 10 [SYN] Seq=0 Win=29200 Len=0 MSS=1460 SACK_PERM=1 TSval=1178665833 TSecr=0 WS=128
     33 0.002609430    192.168.1.2           192.168.1.1           TCP      74     46354 → 52 [SYN] Seq=0 Win=29200 Len=0 MSS=1460 SACK_PERM=1 TSval=1178665833 TSecr=0 WS=128
     34 0.002617917    192.168.1.2           192.168.1.1           TCP      74     56718 → 57 [SYN] Seq=0 Win=29200 Len=0 MSS=1460 SACK_PERM=1 TSval=1178665833 TSecr=0 WS=128
     38 0.002823516    192.168.1.2           192.168.1.1           TCP      74     54986 → 18 [SYN] Seq=0 Win=29200 Len=0 MSS=1460 SACK_PERM=1 TSval=1178665833 TSecr=0 WS=128
     39 0.002833105    192.168.1.2           192.168.1.1           TCP      74     52798 → 59 [SYN] Seq=0 Win=29200 Len=0 MSS=1460 SACK_PERM=1 TSval=1178665833 TSecr=0 WS=128
     40 0.002841133    192.168.1.2           192.168.1.1           TCP      74     47652 → 4 [SYN] Seq=0 Win=29200 Len=0 MSS=1460 SACK_PERM=1 TSval=1178665833 TSecr=0 WS=128
     41 0.002849771    192.168.1.2           192.168.1.1           TCP      74     42038 → 98 [SYN] Seq=0 Win=29200 Len=0 MSS=1460 SACK_PERM=1 TSval=1178665833 TSecr=0 WS=128
     42 0.002858262    192.168.1.2           192.168.1.1           TCP      74     46190 → 44 [SYN] Seq=0 Win=29200 Len=0 MSS=1460 SACK_PERM=1 TSval=1178665833 TSecr=0 WS=128
     43 0.002866464    192.168.1.2           192.168.1.1           TCP      74     52270 → 79 [SYN] Seq=0 Win=29200 Len=0 MSS=1460 SACK_PERM=1 TSval=1178665833 TSecr=0 WS=128
     45 0.003094161    192.168.1.2           192.168.1.1           TCP      74     33228 → 38 [SYN] Seq=0 Win=29200 Len=0 MSS=1460 SACK_PERM=1 TSval=1178665833 TSecr=0 WS=128
     46 0.003108115    192.168.1.2           192.168.1.1           TCP      74     56284 → 67 [SYN] Seq=0 Win=29200 Len=0 MSS=1460 SACK_PERM=1 TSval=1178665833 TSecr=0 WS=128
     48 0.003328205    192.168.1.2           192.168.1.1           TCP      74     45018 → 69 [SYN] Seq=0 Win=29200 Len=0 MSS=1460 SACK_PERM=1 TSval=1178665834 TSecr=0 WS=128
     49 0.003341953    192.168.1.2           192.168.1.1           TCP      74     52876 → 97 [SYN] Seq=0 Win=29200 Len=0 MSS=1460 SACK_PERM=1 TSval=1178665834 TSecr=0 WS=128
     53 0.003591359    192.168.1.2           192.168.1.1           TCP      74     36510 → 33 [SYN] Seq=0 Win=29200 Len=0 MSS=1460 SACK_PERM=1 TSval=1178665834 TSecr=0 WS=128
     54 0.003604639    192.168.1.2           192.168.1.1           TCP      74     55440 → 73 [SYN] Seq=0 Win=29200 Len=0 MSS=1460 SACK_PERM=1 TSval=1178665834 TSecr=0 WS=128
     55 0.003616651    192.168.1.2           192.168.1.1           TCP      74     42836 → 7 [SYN] Seq=0 Win=29200 Len=0 MSS=1460 SACK_PERM=1 TSval=1178665834 TSecr=0 WS=128
     56 0.003629097    192.168.1.2           192.168.1.1           TCP      74     44282 → 45 [SYN] Seq=0 Win=29200 Len=0 MSS=1460 SACK_PERM=1 TSval=1178665834 TSecr=0 WS=128
     57 0.003641243    192.168.1.2           192.168.1.1           TCP      74     57896 → 66 [SYN] Seq=0 Win=29200 Len=0 MSS=1460 SACK_PERM=1 TSval=1178665834 TSecr=0 WS=128
     58 0.003654057    192.168.1.2           192.168.1.1           TCP      74     43128 → 77 [SYN] Seq=0 Win=29200 Len=0 MSS=1460 SACK_PERM=1 TSval=1178665834 TSecr=0 WS=128
     62 0.003842650    192.168.1.2           192.168.1.1           TCP      74     54966 → 11 [SYN] Seq=0 Win=29200 Len=0 MSS=1460 SACK_PERM=1 TSval=1178665834 TSecr=0 WS=128
     63 0.003856167    192.168.1.2           192.168.1.1           TCP      74     40846 → 29 [SYN] Seq=0 Win=29200 Len=0 MSS=1460 SACK_PERM=1 TSval=1178665834 TSecr=0 WS=128
     64 0.003868500    192.168.1.2           192.168.1.1           TCP      74     50354 → 100 [SYN] Seq=0 Win=29200 Len=0 MSS=1460 SACK_PERM=1 TSval=1178665834 TSecr=0 WS=128
     65 0.003880598    192.168.1.2           192.168.1.1           TCP      74     44900 → 20 [SYN] Seq=0 Win=29200 Len=0 MSS=1460 SACK_PERM=1 TSval=1178665834 TSecr=0 WS=128
     66 0.003892728    192.168.1.2           192.168.1.1           TCP      74     47232 → 51 [SYN] Seq=0 Win=29200 Len=0 MSS=1460 SACK_PERM=1 TSval=1178665834 TSecr=0 WS=128
     67 0.003904893    192.168.1.2           192.168.1.1           TCP      74     56990 → 62 [SYN] Seq=0 Win=29200 Len=0 MSS=1460 SACK_PERM=1 TSval=1178665834 TSecr=0 WS=128
     70 0.004088845    192.168.1.2           192.168.1.1           TCP      74     33398 → 6 [SYN] Seq=0 Win=29200 Len=0 MSS=1460 SACK_PERM=1 TSval=1178665834 TSecr=0 WS=128
     71 0.004102769    192.168.1.2           192.168.1.1           TCP      74     55016 → 96 [SYN] Seq=0 Win=29200 Len=0 MSS=1460 SACK_PERM=1 TSval=1178665834 TSecr=0 WS=128
     72 0.004115106    192.168.1.2           192.168.1.1           TCP      74     36674 → 32 [SYN] Seq=0 Win=29200 Len=0 MSS=1460 SACK_PERM=1 TSval=1178665834 TSecr=0 WS=128
     73 0.004126863    192.168.1.2           192.168.1.1           TCP      74     38592 → 88 [SYN] Seq=0 Win=29200 Len=0 MSS=1460 SACK_PERM=1 TSval=1178665834 TSecr=0 WS=128
     78 0.004350283    192.168.1.2           192.168.1.1           TCP      74     60002 → 50 [SYN] Seq=0 Win=29200 Len=0 MSS=1460 SACK_PERM=1 TSval=1178665835 TSecr=0 WS=128
     79 0.004363402    192.168.1.2           192.168.1.1           TCP      74     43130 → 13 [SYN] Seq=0 Win=29200 Len=0 MSS=1460 SACK_PERM=1 TSval=1178665835 TSecr=0 WS=128
     80 0.004375883    192.168.1.2           192.168.1.1           TCP      74     47996 → 31 [SYN] Seq=0 Win=29200 Len=0 MSS=1460 SACK_PERM=1 TSval=1178665835 TSecr=0 WS=128
     81 0.004387949    192.168.1.2           192.168.1.1           TCP      74     48384 → 47 [SYN] Seq=0 Win=29200 Len=0 MSS=1460 SACK_PERM=1 TSval=1178665835 TSecr=0 WS=128
     82 0.004401672    192.168.1.2           192.168.1.1           TCP      74     37694 → 72 [SYN] Seq=0 Win=29200 Len=0 MSS=1460 SACK_PERM=1 TSval=1178665835 TSecr=0 WS=128
     83 0.004415775    192.168.1.2           192.168.1.1           TCP      74     60834 → 75 [SYN] Seq=0 Win=29200 Len=0 MSS=1460 SACK_PERM=1 TSval=1178665835 TSecr=0 WS=128
     84 0.004429470    192.168.1.2           192.168.1.1           TCP      74     45064 → 39 [SYN] Seq=0 Win=29200 Len=0 MSS=1460 SACK_PERM=1 TSval=1178665835 TSecr=0 WS=128
     85 0.004441491    192.168.1.2           192.168.1.1           TCP      74     38350 → 5 [SYN] Seq=0 Win=29200 Len=0 MSS=1460 SACK_PERM=1 TSval=1178665835 TSecr=0 WS=128
     89 0.004599890    192.168.1.2           192.168.1.1           TCP      74     42860 → 70 [SYN] Seq=0 Win=29200 Len=0 MSS=1460 SACK_PERM=1 TSval=1178665835 TSecr=0 WS=128
     90 0.004613444    192.168.1.2           192.168.1.1           TCP      74     46256 → 49 [SYN] Seq=0 Win=29200 Len=0 MSS=1460 SACK_PERM=1 TSval=1178665835 TSecr=0 WS=128
     91 0.004625715    192.168.1.2           192.168.1.1           TCP      74     33102 → 85 [SYN] Seq=0 Win=29200 Len=0 MSS=1460 SACK_PERM=1 TSval=1178665835 TSecr=0 WS=128
     92 0.004637525    192.168.1.2           192.168.1.1           TCP      74     53584 → 36 [SYN] Seq=0 Win=29200 Len=0 MSS=1460 SACK_PERM=1 TSval=1178665835 TSecr=0 WS=128
     93 0.004649023    192.168.1.2           192.168.1.1           TCP      74     39404 → 26 [SYN] Seq=0 Win=29200 Len=0 MSS=1460 SACK_PERM=1 TSval=1178665835 TSecr=0 WS=128
     94 0.004660993    192.168.1.2           192.168.1.1           TCP      74     48714 → 48 [SYN] Seq=0 Win=29200 Len=0 MSS=1460 SACK_PERM=1 TSval=1178665835 TSecr=0 WS=128
     98 0.004846330    192.168.1.2           192.168.1.1           TCP      74     45250 → 9 [SYN] Seq=0 Win=29200 Len=0 MSS=1460 SACK_PERM=1 TSval=1178665835 TSecr=0 WS=128
     99 0.004859787    192.168.1.2           192.168.1.1           TCP      74     34766 → 99 [SYN] Seq=0 Win=29200 Len=0 MSS=1460 SACK_PERM=1 TSval=1178665835 TSecr=0 WS=128
    100 0.004871944    192.168.1.2           192.168.1.1           TCP      74     35610 → 81 [SYN] Seq=0 Win=29200 Len=0 MSS=1460 SACK_PERM=1 TSval=1178665835 TSecr=0 WS=128
    101 0.004883630    192.168.1.2           192.168.1.1           TCP      74     48808 → 82 [SYN] Seq=0 Win=29200 Len=0 MSS=1460 SACK_PERM=1 TSval=1178665835 TSecr=0 WS=128
    102 0.004895889    192.168.1.2           192.168.1.1           TCP      74     36508 → 60 [SYN] Seq=0 Win=29200 Len=0 MSS=1460 SACK_PERM=1 TSval=1178665835 TSecr=0 WS=128
    103 0.004907970    192.168.1.2           192.168.1.1           TCP      74     39754 → 1 [SYN] Seq=0 Win=29200 Len=0 MSS=1460 SACK_PERM=1 TSval=1178665835 TSecr=0 WS=128
    108 0.005100787    192.168.1.2           192.168.1.1           TCP      74     53984 → 19 [SYN] Seq=0 Win=29200 Len=0 MSS=1460 SACK_PERM=1 TSval=1178665835 TSecr=0 WS=128
    109 0.005114114    192.168.1.2           192.168.1.1           TCP      74     46946 → 30 [SYN] Seq=0 Win=29200 Len=0 MSS=1460 SACK_PERM=1 TSval=1178665835 TSecr=0 WS=128
    110 0.005126146    192.168.1.2           192.168.1.1           TCP      74     58028 → 42 [SYN] Seq=0 Win=29200 Len=0 MSS=1460 SACK_PERM=1 TSval=1178665835 TSecr=0 WS=128
    111 0.005137831    192.168.1.2           192.168.1.1           TCP      74     59792 → 12 [SYN] Seq=0 Win=29200 Len=0 MSS=1460 SACK_PERM=1 TSval=1178665835 TSecr=0 WS=128
    112 0.005149650    192.168.1.2           192.168.1.1           TCP      74     56368 → 90 [SYN] Seq=0 Win=29200 Len=0 MSS=1460 SACK_PERM=1 TSval=1178665835 TSecr=0 WS=128
    113 0.005161905    192.168.1.2           192.168.1.1           TCP      74     59926 → 28 [SYN] Seq=0 Win=29200 Len=0 MSS=1460 SACK_PERM=1 TSval=1178665835 TSecr=0 WS=128
    114 0.005174466    192.168.1.2           192.168.1.1           TCP      74     38304 → 78 [SYN] Seq=0 Win=29200 Len=0 MSS=1460 SACK_PERM=1 TSval=1178665835 TSecr=0 WS=128
    115 0.005187603    192.168.1.2           192.168.1.1           TCP      74     55038 → 65 [SYN] Seq=0 Win=29200 Len=0 MSS=1460 SACK_PERM=1 TSval=1178665835 TSecr=0 WS=128
    118 0.005298037    192.168.1.2           192.168.1.1           TCP      66     42836 → 7 [ACK] Seq=1 Ack=1 Win=29312 Len=0 TSval=1178665836 TSecr=3551686546
    120 0.005328869    192.168.1.2           192.168.1.1           TCP      66     42836 → 7 [RST, ACK] Seq=1 Ack=1 Win=29312 Len=0 TSval=1178665836 TSecr=3551686546
    121 0.005362256    192.168.1.2           192.168.1.1           TCP      74     52708 → 3 [SYN] Seq=0 Win=29200 Len=0 MSS=1460 SACK_PERM=1 TSval=1178665836 TSecr=0 WS=128
    122 0.005375090    192.168.1.2           192.168.1.1           TCP      74     37590 → 83 [SYN] Seq=0 Win=29200 Len=0 MSS=1460 SACK_PERM=1 TSval=1178665836 TSecr=0 WS=128
    123 0.005386941    192.168.1.2           192.168.1.1           TCP      74     51552 → 14 [SYN] Seq=0 Win=29200 Len=0 MSS=1460 SACK_PERM=1 TSval=1178665836 TSecr=0 WS=128
    124 0.005398651    192.168.1.2           192.168.1.1           TCP      74     55002 → 54 [SYN] Seq=0 Win=29200 Len=0 MSS=1460 SACK_PERM=1 TSval=1178665836 TSecr=0 WS=128
    125 0.005410368    192.168.1.2           192.168.1.1           TCP      74     47518 → 64 [SYN] Seq=0 Win=29200 Len=0 MSS=1460 SACK_PERM=1 TSval=1178665836 TSecr=0 WS=128
    126 0.005424079    192.168.1.2           192.168.1.1           TCP      74     43838 → 89 [SYN] Seq=0 Win=29200 Len=0 MSS=1460 SACK_PERM=1 TSval=1178665836 TSecr=0 WS=128
    131 0.005604950    192.168.1.2           192.168.1.1           TCP      74     55002 → 40 [SYN] Seq=0 Win=29200 Len=0 MSS=1460 SACK_PERM=1 TSval=1178665836 TSecr=0 WS=128
    132 0.005618196    192.168.1.2           192.168.1.1           TCP      74     54796 → 46 [SYN] Seq=0 Win=29200 Len=0 MSS=1460 SACK_PERM=1 TSval=1178665836 TSecr=0 WS=128
    133 0.005630337    192.168.1.2           192.168.1.1           TCP      74     37718 → 68 [SYN] Seq=0 Win=29200 Len=0 MSS=1460 SACK_PERM=1 TSval=1178665836 TSecr=0 WS=128
    134 0.005642432    192.168.1.2           192.168.1.1           TCP      74     58400 → 63 [SYN] Seq=0 Win=29200 Len=0 MSS=1460 SACK_PERM=1 TSval=1178665836 TSecr=0 WS=128
    135 0.005654507    192.168.1.2           192.168.1.1           TCP      74     51984 → 74 [SYN] Seq=0 Win=29200 Len=0 MSS=1460 SACK_PERM=1 TSval=1178665836 TSecr=0 WS=128
    136 0.005666394    192.168.1.2           192.168.1.1           TCP      74     35372 → 16 [SYN] Seq=0 Win=29200 Len=0 MSS=1460 SACK_PERM=1 TSval=1178665836 TSecr=0 WS=128
    137 0.005679277    192.168.1.2           192.168.1.1           TCP      74     39568 → 56 [SYN] Seq=0 Win=29200 Len=0 MSS=1460 SACK_PERM=1 TSval=1178665836 TSecr=0 WS=128
    138 0.005691230    192.168.1.2           192.168.1.1           TCP      74     36658 → 95 [SYN] Seq=0 Win=29200 Len=0 MSS=1460 SACK_PERM=1 TSval=1178665836 TSecr=0 WS=128
    142 0.005850314    192.168.1.2           192.168.1.1           TCP      74     56608 → 17 [SYN] Seq=0 Win=29200 Len=0 MSS=1460 SACK_PERM=1 TSval=1178665836 TSecr=0 WS=128
    143 0.005863555    192.168.1.2           192.168.1.1           TCP      74     57796 → 2 [SYN] Seq=0 Win=29200 Len=0 MSS=1460 SACK_PERM=1 TSval=1178665836 TSecr=0 WS=128
    144 0.005875966    192.168.1.2           192.168.1.1           TCP      74     35628 → 37 [SYN] Seq=0 Win=29200 Len=0 MSS=1460 SACK_PERM=1 TSval=1178665836 TSecr=0 WS=128
    145 0.005889842    192.168.1.2           192.168.1.1           TCP      74     49762 → 27 [SYN] Seq=0 Win=29200 Len=0 MSS=1460 SACK_PERM=1 TSval=1178665836 TSecr=0 WS=128
    146 0.005902040    192.168.1.2           192.168.1.1           TCP      74     42046 → 61 [SYN] Seq=0 Win=29200 Len=0 MSS=1460 SACK_PERM=1 TSval=1178665836 TSecr=0 WS=128
    147 0.005913872    192.168.1.2           192.168.1.1           TCP      74     40820 → 71 [SYN] Seq=0 Win=29200 Len=0 MSS=1460 SACK_PERM=1 TSval=1178665836 TSecr=0 WS=128
    150 0.006094817    192.168.1.2           192.168.1.1           TCP      74     40816 → 58 [SYN] Seq=0 Win=29200 Len=0 MSS=1460 SACK_PERM=1 TSval=1178665836 TSecr=0 WS=128
    151 0.006108169    192.168.1.2           192.168.1.1           TCP      74     38968 → 8 [SYN] Seq=0 Win=29200 Len=0 MSS=1460 SACK_PERM=1 TSval=1178665836 TSecr=0 WS=128
    152 0.006120039    192.168.1.2           192.168.1.1           TCP      74     60862 → 34 [SYN] Seq=0 Win=29200 Len=0 MSS=1460 SACK_PERM=1 TSval=1178665836 TSecr=0 WS=128
    153 0.006132276    192.168.1.2           192.168.1.1           TCP      74     34154 → 92 [SYN] Seq=0 Win=29200 Len=0 MSS=1460 SACK_PERM=1 TSval=1178665836 TSecr=0 WS=128
    178 0.008081888    192.168.1.2           192.168.1.1           TCP      66     53984 → 19 [ACK] Seq=1 Ack=1 Win=29312 Len=0 TSval=1178665838 TSecr=3551686549
    182 0.008117985    192.168.1.2           192.168.1.1           TCP      66     53984 → 19 [RST, ACK] Seq=1 Ack=1 Win=29312 Len=0 TSval=1178665838 TSecr=3551686549
