      2 0.001112182    192.168.1.1           192.168.1.2           TCP      74     19 → 53762 [SYN, ACK] Seq=0 Ack=1 Win=28960 Len=0 MSS=1460 SACK_PERM=1[Packet size limited during capture]
      4 0.002872614    192.168.1.1           192.168.1.2           TCP      140    19 → 53762 [PSH, ACK] Seq=1 Ack=1 Win=227 Len=74 TSval=3550878552 TSecr=1177857848
      6 0.007502053    192.168.1.1           192.168.1.2           TCP      1514   19 → 53762 [ACK] Seq=75 Ack=1 Win=227 Len=1448 TSval=3550878552 TSecr=1177857848
      8 0.008724391    192.168.1.1           192.168.1.2           TCP      1514   19 → 53762 [ACK] Seq=1523 Ack=1 Win=227 Len=1448 TSval=3550878552 TSecr=1177857848
     10 0.009771854    192.168.1.1           192.168.1.2           TCP      1514   19 → 53762 [ACK] Seq=2971 Ack=1 Win=227 Len=1448 TSval=3550878552 TSecr=1177857848
     12 0.011045289    192.168.1.1           192.168.1.2           TCP      1514   19 → 53762 [ACK] Seq=4419 Ack=1 Win=227 Len=1448 TSval=3550878553 TSecr=1177857848
     14 0.012266602    192.168.1.1           192.168.1.2           TCP      1514   19 → 53762 [ACK] Seq=5867 Ack=1 Win=227 Len=1448 TSval=3550878553 TSecr=1177857848
     16 0.013497908    192.168.1.1           192.168.1.2           TCP      1514   19 → 53762 [ACK] Seq=7315 Ack=1 Win=227 Len=1448 TSval=3550878553 TSecr=1177857848
     18 0.014742207    192.168.1.1           192.168.1.2           TCP      1514   19 → 53762 [ACK] Seq=8763 Ack=1 Win=227 Len=1448 TSval=3550878553 TSecr=1177857848
     20 0.015972588    192.168.1.1           192.168.1.2           TCP      1514   19 → 53762 [ACK] Seq=10211 Ack=1 Win=227 Len=1448 TSval=3550878554 TSecr=1177857850
     22 0.017250841    192.168.1.1           192.168.1.2           TCP      1514   19 → 53762 [ACK] Seq=11659 Ack=1 Win=227 Len=1448 TSval=3550878555 TSecr=1177857850
     24 0.018511891    192.168.1.1           192.168.1.2           TCP      1514   19 → 53762 [ACK] Seq=13107 Ack=1 Win=227 Len=1448 TSval=3550878556 TSecr=1177857850
     26 0.019800434    192.168.1.1           192.168.1.2           TCP      1514   19 → 53762 [ACK] Seq=14555 Ack=1 Win=227 Len=1448 TSval=3550878559 TSecr=1177857854
     28 0.021050358    192.168.1.1           192.168.1.2           TCP      1514   19 → 53762 [ACK] Seq=16003 Ack=1 Win=227 Len=1448 TSval=3550878561 TSecr=1177857857
     30 0.022314522    192.168.1.1           192.168.1.2           TCP      1514   19 → 53762 [ACK] Seq=17451 Ack=1 Win=227 Len=1448 TSval=3550878563 TSecr=1177857858
     32 0.023500302    192.168.1.1           192.168.1.2           TCP      1514   19 → 53762 [ACK] Seq=18899 Ack=1 Win=227 Len=1448 TSval=3550878564 TSecr=1177857859
     34 0.024750105    192.168.1.1           192.168.1.2           TCP      1514   19 → 53762 [ACK] Seq=20347 Ack=1 Win=227 Len=1448 TSval=3550878565 TSecr=1177857860
     36 0.025986764    192.168.1.1           192.168.1.2           TCP      1514   19 → 53762 [ACK] Seq=21795 Ack=1 Win=227 Len=1448 TSval=3550878566 TSecr=1177857862
     38 0.027221569    192.168.1.1           192.168.1.2           TCP      1514   19 → 53762 [ACK] Seq=23243 Ack=1 Win=227 Len=1448 TSval=3550878568 TSecr=1177857863
     40 0.028248766    192.168.1.1           192.168.1.2           TCP      1514   19 → 53762 [ACK] Seq=24691 Ack=1 Win=227 Len=1448 TSval=3550878569 TSecr=1177857864
     42 0.029503272    192.168.1.1           192.168.1.2           TCP      1514   19 → 53762 [PSH, ACK] Seq=26139 Ack=1 Win=227 Len=1448 TSval=3550878570 TSecr=1177857866
     44 0.030719781    192.168.1.1           192.168.1.2           TCP      1514   19 → 53762 [ACK] Seq=27587 Ack=1 Win=227 Len=1448 TSval=3550878571 TSecr=1177857867
     46 0.031981653    192.168.1.1           192.168.1.2           TCP      1514   19 → 53762 [ACK] Seq=29035 Ack=1 Win=227 Len=1448 TSval=3550878572 TSecr=1177857868
     48 0.033226901    192.168.1.1           192.168.1.2           TCP      1514   19 → 53762 [ACK] Seq=30483 Ack=1 Win=227 Len=1448 TSval=3550878574 TSecr=1177857869
     50 0.034473905    192.168.1.1           192.168.1.2           TCP      1514   19 → 53762 [ACK] Seq=31931 Ack=1 Win=227 Len=1448 TSval=3550878575 TSecr=1177857870
     52 0.035754012    192.168.1.1           192.168.1.2           TCP      1514   19 → 53762 [ACK] Seq=33379 Ack=1 Win=227 Len=1448 TSval=3550878576 TSecr=1177857872
     54 0.037007418    192.168.1.1           192.168.1.2           TCP      1514   19 → 53762 [ACK] Seq=34827 Ack=1 Win=227 Len=1448 TSval=3550878577 TSecr=1177857873
     56 0.038231444    192.168.1.1           192.168.1.2           TCP      1514   19 → 53762 [PSH, ACK] Seq=36275 Ack=1 Win=227 Len=1448 TSval=3550878579 TSecr=1177857874
     58 0.039480421    192.168.1.1           192.168.1.2           TCP      1514   19 → 53762 [ACK] Seq=37723 Ack=1 Win=227 Len=1448 TSval=3550878580 TSecr=1177857875
     60 0.040768218    192.168.1.1           192.168.1.2           TCP      1514   19 → 53762 [ACK] Seq=39171 Ack=1 Win=227 Len=1448 TSval=3550878581 TSecr=1177857876
     62 0.041998602    192.168.1.1           192.168.1.2           TCP      1514   19 → 53762 [ACK] Seq=40619 Ack=1 Win=227 Len=1448 TSval=3550878582 TSecr=1177857878
     64 0.043245868    192.168.1.1           192.168.1.2           TCP      1514   19 → 53762 [ACK] Seq=42067 Ack=1 Win=227 Len=1448 TSval=3550878584 TSecr=1177857879
     66 0.044555839    192.168.1.1           192.168.1.2           TCP      1514   19 → 53762 [ACK] Seq=43515 Ack=1 Win=227 Len=1448 TSval=3550878585 TSecr=1177857880
     68 0.045772708    192.168.1.1           192.168.1.2           TCP      1514   19 → 53762 [ACK] Seq=44963 Ack=1 Win=227 Len=1448 TSval=3550878586 TSecr=1177857881
     70 0.046750157    192.168.1.1           192.168.1.2           TCP      1514   19 → 53762 [PSH, ACK] Seq=46411 Ack=1 Win=227 Len=1448 TSval=3550878587 TSecr=1177857883
     72 0.048001582    192.168.1.1           192.168.1.2           TCP      1514   19 → 53762 [ACK] Seq=47859 Ack=1 Win=227 Len=1448 TSval=3550878588 TSecr=1177857884
     74 0.049248830    192.168.1.1           192.168.1.2           TCP      1514   19 → 53762 [ACK] Seq=49307 Ack=1 Win=227 Len=1448 TSval=3550878590 TSecr=1177857885
     76 0.050506449    192.168.1.1           192.168.1.2           TCP      1514   19 → 53762 [ACK] Seq=50755 Ack=1 Win=227 Len=1448 TSval=3550878591 TSecr=1177857886
     78 0.051774679    192.168.1.1           192.168.1.2           TCP      1514   19 → 53762 [PSH, ACK] Seq=52203 Ack=1 Win=227 Len=1448 TSval=3550878592 TSecr=1177857888
     80 0.053024200    192.168.1.1           192.168.1.2           TCP      1514   19 → 53762 [ACK] Seq=53651 Ack=1 Win=227 Len=1448 TSval=3550878593 TSecr=1177857889
     82 0.054248286    192.168.1.1           192.168.1.2           TCP      1514   19 → 53762 [ACK] Seq=55099 Ack=1 Win=227 Len=1448 TSval=3550878595 TSecr=1177857890
     84 0.055498378    192.168.1.1           192.168.1.2           TCP      1514   19 → 53762 [PSH, ACK] Seq=56547 Ack=1 Win=227 Len=1448 TSval=3550878596 TSecr=1177857892
     86 0.056773026    192.168.1.1           192.168.1.2           TCP      1514   19 → 53762 [ACK] Seq=57995 Ack=1 Win=227 Len=1448 TSval=3550878597 TSecr=1177857893
     88 0.057998780    192.168.1.1           192.168.1.2           TCP      1514   19 → 53762 [ACK] Seq=59443 Ack=1 Win=227 Len=1448 TSval=3550878598 TSecr=1177857894
     90 0.059246352    192.168.1.1           192.168.1.2           TCP      1514   19 → 53762 [ACK] Seq=60891 Ack=1 Win=227 Len=1448 TSval=3550878600 TSecr=1177857895
     92 0.060496271    192.168.1.1           192.168.1.2           TCP      1514   19 → 53762 [ACK] Seq=62339 Ack=1 Win=227 Len=1448 TSval=3550878601 TSecr=1177857896
     94 0.061766622    192.168.1.1           192.168.1.2           TCP      1514   19 → 53762 [ACK] Seq=63787 Ack=1 Win=227 Len=1448 TSval=3550878602 TSecr=1177857897
     96 0.062981975    192.168.1.1           192.168.1.2           TCP      1514   19 → 53762 [ACK] Seq=65235 Ack=1 Win=227 Len=1448 TSval=3550878603 TSecr=1177857899
     98 0.064226779    192.168.1.1           192.168.1.2           TCP      1514   19 → 53762 [PSH, ACK] Seq=66683 Ack=1 Win=227 Len=1448 TSval=3550878604 TSecr=1177857900
    100 0.065225608    192.168.1.1           192.168.1.2           TCP      1514   19 → 53762 [ACK] Seq=68131 Ack=1 Win=227 Len=1448 TSval=3550878606 TSecr=1177857901
    102 0.066476271    192.168.1.1           192.168.1.2           TCP      1514   19 → 53762 [ACK] Seq=69579 Ack=1 Win=227 Len=1448 TSval=3550878607 TSecr=1177857902
    104 0.067729083    192.168.1.1           192.168.1.2           TCP      1514   19 → 53762 [ACK] Seq=71027 Ack=1 Win=227 Len=1448 TSval=3550878608 TSecr=1177857904
    106 0.068974498    192.168.1.1           192.168.1.2           TCP      1514   19 → 53762 [ACK] Seq=72475 Ack=1 Win=227 Len=1448 TSval=3550878609 TSecr=1177857905
    108 0.070222876    192.168.1.1           192.168.1.2           TCP      1514   19 → 53762 [ACK] Seq=73923 Ack=1 Win=227 Len=1448 TSval=3550878611 TSecr=1177857906
    110 0.071476576    192.168.1.1           192.168.1.2           TCP      1514   19 → 53762 [ACK] Seq=75371 Ack=1 Win=227 Len=1448 TSval=3550878612 TSecr=1177857907
    112 0.072725903    192.168.1.1           192.168.1.2           TCP      1514   19 → 53762 [PSH, ACK] Seq=76819 Ack=1 Win=227 Len=1448 TSval=3550878613 TSecr=1177857909
    114 0.073972652    192.168.1.1           192.168.1.2           TCP      1514   19 → 53762 [ACK] Seq=78267 Ack=1 Win=227 Len=1448 TSval=3550878615 TSecr=1177857910
    116 0.075240059    192.168.1.1           192.168.1.2           TCP      1514   19 → 53762 [ACK] Seq=79715 Ack=1 Win=227 Len=1448 TSval=3550878616 TSecr=1177857911
    118 0.076485697    192.168.1.1           192.168.1.2           TCP      1514   19 → 53762 [ACK] Seq=81163 Ack=1 Win=227 Len=1448 TSval=3550878617 TSecr=1177857912
    120 0.077725175    192.168.1.1           192.168.1.2           TCP      1514   19 → 53762 [ACK] Seq=82611 Ack=1 Win=227 Len=1448 TSval=3550878618 TSecr=1177857913
    122 0.078981880    192.168.1.1           192.168.1.2           TCP      1514   19 → 53762 [ACK] Seq=84059 Ack=1 Win=227 Len=1448 TSval=3550878619 TSecr=1177857915
    124 0.080250974    192.168.1.1           192.168.1.2           TCP      1514   19 → 53762 [ACK] Seq=85507 Ack=1 Win=227 Len=1448 TSval=3550878621 TSecr=1177857916
    126 0.081501353    192.168.1.1           192.168.1.2           TCP      1514   19 → 53762 [PSH, ACK] Seq=86955 Ack=1 Win=227 Len=1448 TSval=3550878622 TSecr=1177857917
    128 0.082495252    192.168.1.1           192.168.1.2           TCP      1514   19 → 53762 [ACK] Seq=88403 Ack=1 Win=227 Len=1448 TSval=3550878623 TSecr=1177857918
    130 0.083748735    192.168.1.1           192.168.1.2           TCP      1514   19 → 53762 [ACK] Seq=89851 Ack=1 Win=227 Len=1448 TSval=3550878624 TSecr=1177857920
    132 0.084998220    192.168.1.1           192.168.1.2           TCP      1514   19 → 53762 [ACK] Seq=91299 Ack=1 Win=227 Len=1448 TSval=3550878626 TSecr=1177857921
    134 0.086241967    192.168.1.1           192.168.1.2           TCP      1514   19 → 53762 [ACK] Seq=92747 Ack=1 Win=227 Len=1448 TSval=3550878627 TSecr=1177857922
    136 0.087492850    192.168.1.1           192.168.1.2           TCP      1514   19 → 53762 [ACK] Seq=94195 Ack=1 Win=227 Len=1448 TSval=3550878628 TSecr=1177857923
    138 0.088742955    192.168.1.1           192.168.1.2           TCP      1514   19 → 53762 [ACK] Seq=95643 Ack=1 Win=227 Len=1448 TSval=3550878629 TSecr=1177857925
    140 0.089975117    192.168.1.1           192.168.1.2           TCP      1514   19 → 53762 [PSH, ACK] Seq=97091 Ack=1 Win=227 Len=1448 TSval=3550878631 TSecr=1177857926
    142 0.091243274    192.168.1.1           192.168.1.2           TCP      1514   19 → 53762 [ACK] Seq=98539 Ack=1 Win=227 Len=1448 TSval=3550878632 TSecr=1177857927
    143 0.092500507    192.168.1.1           192.168.1.2           TCP      1514   19 → 53762 [ACK] Seq=99987 Ack=1 Win=227 Len=1448 TSval=3550878633 TSecr=1177857928
    145 0.093744148    192.168.1.1           192.168.1.2           TCP      1514   19 → 53762 [ACK] Seq=101435 Ack=1 Win=227 Len=1448 TSval=3550878634 TSecr=1177857929
    146 0.094995293    192.168.1.1           192.168.1.2           TCP      1514   19 → 53762 [ACK] Seq=102883 Ack=1 Win=227 Len=1448 TSval=3550878635 TSecr=1177857931
    148 0.096245081    192.168.1.1           192.168.1.2           TCP      1514   19 → 53762 [ACK] Seq=104331 Ack=1 Win=227 Len=1448 TSval=3550878637 TSecr=1177857932
    149 0.097478874    192.168.1.1           192.168.1.2           TCP      1514   19 → 53762 [PSH, ACK] Seq=105779 Ack=1 Win=227 Len=1448 TSval=3550878638 TSecr=1177857933
    151 0.098746494    192.168.1.1           192.168.1.2           TCP      1514   19 → 53762 [PSH, ACK] Seq=107227 Ack=1 Win=227 Len=1448 TSval=3550878639 TSecr=1177857934
    152 0.100003432    192.168.1.1           192.168.1.2           TCP      1514   19 → 53762 [ACK] Seq=108675 Ack=1 Win=227 Len=1448 TSval=3550878640 TSecr=1177857936
    154 0.101003437    192.168.1.1           192.168.1.2           TCP      1514   19 → 53762 [ACK] Seq=110123 Ack=1 Win=227 Len=1448 TSval=3550878642 TSecr=1177857937
    155 0.102255342    192.168.1.1           192.168.1.2           TCP      1514   19 → 53762 [ACK] Seq=111571 Ack=1 Win=227 Len=1448 TSval=3550878643 TSecr=1177857937
    157 0.103504691    192.168.1.1           192.168.1.2           TCP      1514   19 → 53762 [ACK] Seq=113019 Ack=1 Win=227 Len=1448 TSval=3550878644 TSecr=1177857939
    158 0.104755425    192.168.1.1           192.168.1.2           TCP      1514   19 → 53762 [ACK] Seq=114467 Ack=1 Win=227 Len=1448 TSval=3550878645 TSecr=1177857939
    160 0.105999016    192.168.1.1           192.168.1.2           TCP      1514   19 → 53762 [ACK] Seq=115915 Ack=1 Win=227 Len=1448 TSval=3550878647 TSecr=1177857942
    161 0.107249816    192.168.1.1           192.168.1.2           TCP      1514   19 → 53762 [PSH, ACK] Seq=117363 Ack=1 Win=227 Len=1448 TSval=3550878648 TSecr=1177857942
    163 0.108483624    192.168.1.1           192.168.1.2           TCP      1514   19 → 53762 [ACK] Seq=118811 Ack=1 Win=227 Len=1448 TSval=3550878649 TSecr=1177857944
    164 0.109734056    192.168.1.1           192.168.1.2           TCP      1514   19 → 53762 [ACK] Seq=120259 Ack=1 Win=227 Len=1448 TSval=3550878650 TSecr=1177857944
    166 0.110983436    192.168.1.1           192.168.1.2           TCP      1514   19 → 53762 [ACK] Seq=121707 Ack=1 Win=227 Len=1448 TSval=3550878651 TSecr=1177857947
    167 0.112234742    192.168.1.1           192.168.1.2           TCP      1514   19 → 53762 [ACK] Seq=123155 Ack=1 Win=227 Len=1448 TSval=3550878653 TSecr=1177857947
    169 0.113509018    192.168.1.1           192.168.1.2           TCP      1514   19 → 53762 [ACK] Seq=124603 Ack=1 Win=227 Len=1448 TSval=3550878654 TSecr=1177857949
    170 0.114760464    192.168.1.1           192.168.1.2           TCP      1514   19 → 53762 [ACK] Seq=126051 Ack=1 Win=227 Len=1448 TSval=3550878655 TSecr=1177857949
    172 0.115995500    192.168.1.1           192.168.1.2           TCP      1514   19 → 53762 [ACK] Seq=127499 Ack=1 Win=227 Len=1448 TSval=3550878656 TSecr=1177857952
    173 0.117262663    192.168.1.1           192.168.1.2           TCP      1514   19 → 53762 [PSH, ACK] Seq=128947 Ack=1 Win=227 Len=1448 TSval=3550878658 TSecr=1177857952
    175 0.118253288    192.168.1.1           192.168.1.2           TCP      1514   19 → 53762 [ACK] Seq=130395 Ack=1 Win=227 Len=1448 TSval=3550878659 TSecr=1177857954
    176 0.119516038    192.168.1.1           192.168.1.2           TCP      1514   19 → 53762 [ACK] Seq=131843 Ack=1 Win=227 Len=1448 TSval=3550878660 TSecr=1177857954
    178 0.120756029    192.168.1.1           192.168.1.2           TCP      1514   19 → 53762 [ACK] Seq=133291 Ack=1 Win=227 Len=1448 TSval=3550878661 TSecr=1177857957
    179 0.122006031    192.168.1.1           192.168.1.2           TCP      1514   19 → 53762 [ACK] Seq=134739 Ack=1 Win=227 Len=1448 TSval=3550878663 TSecr=1177857957
    181 0.123255677    192.168.1.1           192.168.1.2           TCP      1514   19 → 53762 [ACK] Seq=136187 Ack=1 Win=227 Len=1448 TSval=3550878664 TSecr=1177857959
    182 0.124506744    192.168.1.1           192.168.1.2           TCP      1514   19 → 53762 [ACK] Seq=137635 Ack=1 Win=227 Len=1448 TSval=3550878665 TSecr=1177857959
    184 0.125756986    192.168.1.1           192.168.1.2           TCP      1514   19 → 53762 [ACK] Seq=139083 Ack=1 Win=227 Len=1448 TSval=3550878666 TSecr=1177857962
    185 0.127007528    192.168.1.1           192.168.1.2           TCP      1514   19 → 53762 [ACK] Seq=140531 Ack=1 Win=227 Len=1448 TSval=3550878667 TSecr=1177857962
    187 0.128265149    192.168.1.1           192.168.1.2           TCP      1514   19 → 53762 [ACK] Seq=141979 Ack=1 Win=227 Len=1448 TSval=3550878669 TSecr=1177857964
    188 0.129516010    192.168.1.1           192.168.1.2           TCP      1514   19 → 53762 [PSH, ACK] Seq=143427 Ack=1 Win=227 Len=1448 TSval=3550878670 TSecr=1177857964
    190 0.130766473    192.168.1.1           192.168.1.2           TCP      1514   19 → 53762 [ACK] Seq=144875 Ack=1 Win=227 Len=1448 TSval=3550878671 TSecr=1177857967
    191 0.132016192    192.168.1.1           192.168.1.2           TCP      1514   19 → 53762 [ACK] Seq=146323 Ack=1 Win=227 Len=1448 TSval=3550878672 TSecr=1177857967
    193 0.133266610    192.168.1.1           192.168.1.2           TCP      1514   19 → 53762 [ACK] Seq=147771 Ack=1 Win=227 Len=1448 TSval=3550878674 TSecr=1177857969
    194 0.134517053    192.168.1.1           192.168.1.2           TCP      1514   19 → 53762 [ACK] Seq=149219 Ack=1 Win=227 Len=1448 TSval=3550878675 TSecr=1177857969
    196 0.135767907    192.168.1.1           192.168.1.2           TCP      1514   19 → 53762 [ACK] Seq=150667 Ack=1 Win=227 Len=1448 TSval=3550878676 TSecr=1177857971
    197 0.136767578    192.168.1.1           192.168.1.2           TCP      1514   19 → 53762 [ACK] Seq=152115 Ack=1 Win=227 Len=1448 TSval=3550878677 TSecr=1177857971
    199 0.138018683    192.168.1.1           192.168.1.2           TCP      1514   19 → 53762 [ACK] Seq=153563 Ack=1 Win=227 Len=1448 TSval=3550878679 TSecr=1177857974
    200 0.139268792    192.168.1.1           192.168.1.2           TCP      1514   19 → 53762 [PSH, ACK] Seq=155011 Ack=1 Win=227 Len=1448 TSval=3550878680 TSecr=1177857974
    202 0.140519159    192.168.1.1           192.168.1.2           TCP      1514   19 → 53762 [ACK] Seq=156459 Ack=1 Win=227 Len=1448 TSval=3550878681 TSecr=1177857976
    203 0.141771178    192.168.1.1           192.168.1.2           TCP      1514   19 → 53762 [ACK] Seq=157907 Ack=1 Win=227 Len=1448 TSval=3550878682 TSecr=1177857976
    205 0.143021346    192.168.1.1           192.168.1.2           TCP      1514   19 → 53762 [PSH, ACK] Seq=159355 Ack=1 Win=227 Len=1448 TSval=3550878683 TSecr=1177857979
    206 0.144269423    192.168.1.1           192.168.1.2           TCP      1514   19 → 53762 [ACK] Seq=160803 Ack=1 Win=227 Len=1448 TSval=3550878685 TSecr=1177857979
    208 0.145519774    192.168.1.1           192.168.1.2           TCP      1514   19 → 53762 [ACK] Seq=162251 Ack=1 Win=227 Len=1448 TSval=3550878686 TSecr=1177857981
    209 0.146770870    192.168.1.1           192.168.1.2           TCP      1514   19 → 53762 [ACK] Seq=163699 Ack=1 Win=227 Len=1448 TSval=3550878687 TSecr=1177857981
    211 0.148020765    192.168.1.1           192.168.1.2           TCP      1514   19 → 53762 [ACK] Seq=165147 Ack=1 Win=227 Len=1448 TSval=3550878688 TSecr=1177857984
    212 0.149270837    192.168.1.1           192.168.1.2           TCP      1514   19 → 53762 [PSH, ACK] Seq=166595 Ack=1 Win=227 Len=1448 TSval=3550878690 TSecr=1177857984
    214 0.150503196    192.168.1.1           192.168.1.2           TCP      1514   19 → 53762 [ACK] Seq=168043 Ack=1 Win=227 Len=1448 TSval=3550878691 TSecr=1177857986
    215 0.151751864    192.168.1.1           192.168.1.2           TCP      1514   19 → 53762 [ACK] Seq=169491 Ack=1 Win=227 Len=1448 TSval=3550878692 TSecr=1177857986
    217 0.153027973    192.168.1.1           192.168.1.2           TCP      1514   19 → 53762 [ACK] Seq=170939 Ack=1 Win=227 Len=1448 TSval=3550878693 TSecr=1177857989
    218 0.154036145    192.168.1.1           192.168.1.2           TCP      1514   19 → 53762 [ACK] Seq=172387 Ack=1 Win=227 Len=1448 TSval=3550878695 TSecr=1177857989
    220 0.155267751    192.168.1.1           192.168.1.2           TCP      1514   19 → 53762 [ACK] Seq=173835 Ack=1 Win=227 Len=1448 TSval=3550878696 TSecr=1177857991
    221 0.156535183    192.168.1.1           192.168.1.2           TCP      1514   19 → 53762 [ACK] Seq=175283 Ack=1 Win=227 Len=1448 TSval=3550878697 TSecr=1177857991
    223 0.157777439    192.168.1.1           192.168.1.2           TCP      1514   19 → 53762 [ACK] Seq=176731 Ack=1 Win=227 Len=1448 TSval=3550878698 TSecr=1177857994
    224 0.159026144    192.168.1.1           192.168.1.2           TCP      1514   19 → 53762 [PSH, ACK] Seq=178179 Ack=1 Win=227 Len=1448 TSval=3550878699 TSecr=1177857994
    226 0.160275154    192.168.1.1           192.168.1.2           TCP      1514   19 → 53762 [ACK] Seq=179627 Ack=1 Win=227 Len=1448 TSval=3550878701 TSecr=1177857996
    227 0.161526986    192.168.1.1           192.168.1.2           TCP      1514   19 → 53762 [ACK] Seq=181075 Ack=1 Win=227 Len=1448 TSval=3550878702 TSecr=1177857996
    229 0.162776984    192.168.1.1           192.168.1.2           TCP      1514   19 → 53762 [ACK] Seq=182523 Ack=1 Win=227 Len=1448 TSval=3550878703 TSecr=1177857999
    230 0.164026942    192.168.1.1           192.168.1.2           TCP      1514   19 → 53762 [ACK] Seq=183971 Ack=1 Win=227 Len=1448 TSval=3550878705 TSecr=1177857999
    232 0.165277417    192.168.1.1           192.168.1.2           TCP      1514   19 → 53762 [ACK] Seq=185419 Ack=1 Win=227 Len=1448 TSval=3550878706 TSecr=1177858001
    233 0.166527169    192.168.1.1           192.168.1.2           TCP      1514   19 → 53762 [ACK] Seq=186867 Ack=1 Win=227 Len=1448 TSval=3550878707 TSecr=1177858001
    235 0.167777801    192.168.1.1           192.168.1.2           TCP      1514   19 → 53762 [ACK] Seq=188315 Ack=1 Win=227 Len=1448 TSval=3550878708 TSecr=1177858004
    236 0.169025931    192.168.1.1           192.168.1.2           TCP      1514   19 → 53762 [PSH, ACK] Seq=189763 Ack=1 Win=227 Len=1448 TSval=3550878710 TSecr=1177858004
    238 0.170275465    192.168.1.1           192.168.1.2           TCP      1514   19 → 53762 [ACK] Seq=191211 Ack=1 Win=227 Len=1448 TSval=3550878711 TSecr=1177858006
    239 0.171527642    192.168.1.1           192.168.1.2           TCP      1514   19 → 53762 [ACK] Seq=192659 Ack=1 Win=227 Len=1448 TSval=3550878712 TSecr=1177858006
    241 0.172526081    192.168.1.1           192.168.1.2           TCP      1514   19 → 53762 [ACK] Seq=194107 Ack=1 Win=227 Len=1448 TSval=3550878713 TSecr=1177858009
    242 0.173776257    192.168.1.1           192.168.1.2           TCP      1514   19 → 53762 [ACK] Seq=195555 Ack=1 Win=227 Len=1448 TSval=3550878714 TSecr=1177858009
    244 0.175026699    192.168.1.1           192.168.1.2           TCP      1514   19 → 53762 [ACK] Seq=197003 Ack=1 Win=227 Len=1448 TSval=3550878716 TSecr=1177858011
    245 0.176276773    192.168.1.1           192.168.1.2           TCP      1514   19 → 53762 [ACK] Seq=198451 Ack=1 Win=227 Len=1448 TSval=3550878717 TSecr=1177858011
    247 0.177526988    192.168.1.1           192.168.1.2           TCP      1514   19 → 53762 [ACK] Seq=199899 Ack=1 Win=227 Len=1448 TSval=3550878718 TSecr=1177858014
    248 0.178776377    192.168.1.1           192.168.1.2           TCP      1514   19 → 53762 [PSH, ACK] Seq=201347 Ack=1 Win=227 Len=1448 TSval=3550878719 TSecr=1177858014
    250 0.180027484    192.168.1.1           192.168.1.2           TCP      1514   19 → 53762 [ACK] Seq=202795 Ack=1 Win=227 Len=1448 TSval=3550878721 TSecr=1177858016
    251 0.181277167    192.168.1.1           192.168.1.2           TCP      1514   19 → 53762 [ACK] Seq=204243 Ack=1 Win=227 Len=1448 TSval=3550878722 TSecr=1177858016
    253 0.182506205    192.168.1.1           192.168.1.2           TCP      1514   19 → 53762 [ACK] Seq=205691 Ack=1 Win=227 Len=1448 TSval=3550878723 TSecr=1177858019
    254 0.183756362    192.168.1.1           192.168.1.2           TCP      1514   19 → 53762 [ACK] Seq=207139 Ack=1 Win=227 Len=1448 TSval=3550878724 TSecr=1177858019
    256 0.185008418    192.168.1.1           192.168.1.2           TCP      1514   19 → 53762 [ACK] Seq=208587 Ack=1 Win=227 Len=1448 TSval=3550878726 TSecr=1177858021
    257 0.186257078    192.168.1.1           192.168.1.2           TCP      1514   19 → 53762 [ACK] Seq=210035 Ack=1 Win=227 Len=1448 TSval=3550878727 TSecr=1177858021
    259 0.187507990    192.168.1.1           192.168.1.2           TCP      1514   19 → 53762 [ACK] Seq=211483 Ack=1 Win=227 Len=1448 TSval=3550878728 TSecr=1177858023
    260 0.188780505    192.168.1.1           192.168.1.2           TCP      1514   19 → 53762 [PSH, ACK] Seq=212931 Ack=1 Win=227 Len=1448 TSval=3550878729 TSecr=1177858023
    262 0.190035482    192.168.1.1           192.168.1.2           TCP      1514   19 → 53762 [ACK] Seq=214379 Ack=1 Win=227 Len=1448 TSval=3550878730 TSecr=1177858026
    263 0.191010944    192.168.1.1           192.168.1.2           TCP      1514   19 → 53762 [ACK] Seq=215827 Ack=1 Win=227 Len=1448 TSval=3550878732 TSecr=1177858026
    265 0.192272957    192.168.1.1           192.168.1.2           TCP      1514   19 → 53762 [ACK] Seq=217275 Ack=1 Win=227 Len=1448 TSval=3550878733 TSecr=1177858028
    266 0.193512855    192.168.1.1           192.168.1.2           TCP      1514   19 → 53762 [ACK] Seq=218723 Ack=1 Win=227 Len=1448 TSval=3550878734 TSecr=1177858028
    268 0.194758005    192.168.1.1           192.168.1.2           TCP      1514   19 → 53762 [ACK] Seq=220171 Ack=1 Win=227 Len=1448 TSval=3550878735 TSecr=1177858031
    269 0.196008498    192.168.1.1           192.168.1.2           TCP      1514   19 → 53762 [ACK] Seq=221619 Ack=1 Win=227 Len=1448 TSval=3550878737 TSecr=1177858031
    271 0.197257528    192.168.1.1           192.168.1.2           TCP      1514   19 → 53762 [ACK] Seq=223067 Ack=1 Win=227 Len=1448 TSval=3550878738 TSecr=1177858033
    272 0.198508269    192.168.1.1           192.168.1.2           TCP      1514   19 → 53762 [PSH, ACK] Seq=224515 Ack=1 Win=227 Len=1448 TSval=3550878739 TSecr=1177858033
    274 0.199758128    192.168.1.1           192.168.1.2           TCP      1514   19 → 53762 [ACK] Seq=225963 Ack=1 Win=227 Len=1448 TSval=3550878740 TSecr=1177858036
    275 0.201008243    192.168.1.1           192.168.1.2           TCP      1514   19 → 53762 [ACK] Seq=227411 Ack=1 Win=227 Len=1448 TSval=3550878742 TSecr=1177858036
    277 0.202258140    192.168.1.1           192.168.1.2           TCP      1514   19 → 53762 [ACK] Seq=228859 Ack=1 Win=227 Len=1448 TSval=3550878743 TSecr=1177858038
    278 0.203531825    192.168.1.1           192.168.1.2           TCP      1514   19 → 53762 [ACK] Seq=230307 Ack=1 Win=227 Len=1448 TSval=3550878744 TSecr=1177858038
    280 0.204781636    192.168.1.1           192.168.1.2           TCP      1514   19 → 53762 [ACK] Seq=231755 Ack=1 Win=227 Len=1448 TSval=3550878745 TSecr=1177858041
    281 0.206040905    192.168.1.1           192.168.1.2           TCP      1514   19 → 53762 [ACK] Seq=233203 Ack=1 Win=227 Len=1448 TSval=3550878746 TSecr=1177858041
    283 0.207291134    192.168.1.1           192.168.1.2           TCP      1514   19 → 53762 [ACK] Seq=234651 Ack=1 Win=227 Len=1448 TSval=3550878748 TSecr=1177858043
    284 0.208540454    192.168.1.1           192.168.1.2           TCP      1514   19 → 53762 [PSH, ACK] Seq=236099 Ack=1 Win=227 Len=1448 TSval=3550878749 TSecr=1177858043
    286 0.209540470    192.168.1.1           192.168.1.2           TCP      1514   19 → 53762 [ACK] Seq=237547 Ack=1 Win=227 Len=1448 TSval=3550878750 TSecr=1177858045
    287 0.210790989    192.168.1.1           192.168.1.2           TCP      1514   19 → 53762 [ACK] Seq=238995 Ack=1 Win=227 Len=1448 TSval=3550878751 TSecr=1177858045
    289 0.212040697    192.168.1.1           192.168.1.2           TCP      1514   19 → 53762 [ACK] Seq=240443 Ack=1 Win=227 Len=1448 TSval=3550878753 TSecr=1177858048
    290 0.213290675    192.168.1.1           192.168.1.2           TCP      1514   19 → 53762 [ACK] Seq=241891 Ack=1 Win=227 Len=1448 TSval=3550878754 TSecr=1177858048
    292 0.214540480    192.168.1.1           192.168.1.2           TCP      1514   19 → 53762 [ACK] Seq=243339 Ack=1 Win=227 Len=1448 TSval=3550878755 TSecr=1177858051
    293 0.215790960    192.168.1.1           192.168.1.2           TCP      1514   19 → 53762 [ACK] Seq=244787 Ack=1 Win=227 Len=1448 TSval=3550878756 TSecr=1177858051
    295 0.217040250    192.168.1.1           192.168.1.2           TCP      1514   19 → 53762 [ACK] Seq=246235 Ack=1 Win=227 Len=1448 TSval=3550878758 TSecr=1177858053
    296 0.218290442    192.168.1.1           192.168.1.2           TCP      1514   19 → 53762 [PSH, ACK] Seq=247683 Ack=1 Win=227 Len=1448 TSval=3550878759 TSecr=1177858053
    298 0.219540537    192.168.1.1           192.168.1.2           TCP      1514   19 → 53762 [ACK] Seq=249131 Ack=1 Win=227 Len=1448 TSval=3550878760 TSecr=1177858056
    299 0.220785646    192.168.1.1           192.168.1.2           TCP      1514   19 → 53762 [ACK] Seq=250579 Ack=1 Win=227 Len=1448 TSval=3550878761 TSecr=1177858056
    301 0.222036079    192.168.1.1           192.168.1.2           TCP      1514   19 → 53762 [ACK] Seq=252027 Ack=1 Win=227 Len=1448 TSval=3550878762 TSecr=1177858058
    302 0.223285903    192.168.1.1           192.168.1.2           TCP      1514   19 → 53762 [ACK] Seq=253475 Ack=1 Win=227 Len=1448 TSval=3550878764 TSecr=1177858058
    304 0.224536204    192.168.1.1           192.168.1.2           TCP      1514   19 → 53762 [ACK] Seq=254923 Ack=1 Win=227 Len=1448 TSval=3550878765 TSecr=1177858060
    305 0.225787018    192.168.1.1           192.168.1.2           TCP      1514   19 → 53762 [ACK] Seq=256371 Ack=1 Win=227 Len=1448 TSval=3550878766 TSecr=1177858060
    307 0.226788252    192.168.1.1           192.168.1.2           TCP      1514   19 → 53762 [ACK] Seq=257819 Ack=1 Win=227 Len=1448 TSval=3550878767 TSecr=1177858063
    308 0.228014387    192.168.1.1           192.168.1.2           TCP      1514   19 → 53762 [PSH, ACK] Seq=259267 Ack=1 Win=227 Len=1448 TSval=3550878769 TSecr=1177858063
    310 0.229287606    192.168.1.1           192.168.1.2           TCP      1514   19 → 53762 [ACK] Seq=260715 Ack=1 Win=227 Len=1448 TSval=3550878770 TSecr=1177858065
    311 0.230513954    192.168.1.1           192.168.1.2           TCP      1514   19 → 53762 [ACK] Seq=262163 Ack=1 Win=227 Len=1448 TSval=3550878771 TSecr=1177858065
    313 0.231770781    192.168.1.1           192.168.1.2           TCP      1514   19 → 53762 [ACK] Seq=263611 Ack=1 Win=227 Len=1448 TSval=3550878772 TSecr=1177858068
    314 0.233010712    192.168.1.1           192.168.1.2           TCP      1514   19 → 53762 [ACK] Seq=265059 Ack=1 Win=227 Len=1448 TSval=3550878774 TSecr=1177858068
    316 0.234275927    192.168.1.1           192.168.1.2           TCP      1514   19 → 53762 [PSH, ACK] Seq=266507 Ack=1 Win=227 Len=1448 TSval=3550878775 TSecr=1177858070
    317 0.235570022    192.168.1.1           192.168.1.2           TCP      1514   19 → 53762 [ACK] Seq=267955 Ack=1 Win=227 Len=1448 TSval=3550878776 TSecr=1177858070
    319 0.236795728    192.168.1.1           192.168.1.2           TCP      1514   19 → 53762 [ACK] Seq=269403 Ack=1 Win=227 Len=1448 TSval=3550878777 TSecr=1177858073
    320 0.238047006    192.168.1.1           192.168.1.2           TCP      1514   19 → 53762 [PSH, ACK] Seq=270851 Ack=1 Win=227 Len=1448 TSval=3550878778 TSecr=1177858073
    322 0.239294539    192.168.1.1           192.168.1.2           TCP      1514   19 → 53762 [ACK] Seq=272299 Ack=1 Win=227 Len=1448 TSval=3550878780 TSecr=1177858075
    323 0.240544581    192.168.1.1           192.168.1.2           TCP      1514   19 → 53762 [ACK] Seq=273747 Ack=1 Win=227 Len=1448 TSval=3550878781 TSecr=1177858075
    325 0.241794623    192.168.1.1           192.168.1.2           TCP      1514   19 → 53762 [ACK] Seq=275195 Ack=1 Win=227 Len=1448 TSval=3550878782 TSecr=1177858077
    326 0.243042079    192.168.1.1           192.168.1.2           TCP      1514   19 → 53762 [ACK] Seq=276643 Ack=1 Win=227 Len=1448 TSval=3550878783 TSecr=1177858077
    328 0.244294366    192.168.1.1           192.168.1.2           TCP      1514   19 → 53762 [ACK] Seq=278091 Ack=1 Win=227 Len=1448 TSval=3550878785 TSecr=1177858080
    329 0.245291943    192.168.1.1           192.168.1.2           TCP      1514   19 → 53762 [ACK] Seq=279539 Ack=1 Win=227 Len=1448 TSval=3550878786 TSecr=1177858080
    331 0.246544781    192.168.1.1           192.168.1.2           TCP      1514   19 → 53762 [ACK] Seq=280987 Ack=1 Win=227 Len=1448 TSval=3550878787 TSecr=1177858083
    332 0.247794472    192.168.1.1           192.168.1.2           TCP      1514   19 → 53762 [PSH, ACK] Seq=282435 Ack=1 Win=227 Len=1448 TSval=3550878788 TSecr=1177858083
    334 0.249045209    192.168.1.1           192.168.1.2           TCP      1514   19 → 53762 [ACK] Seq=283883 Ack=1 Win=227 Len=1448 TSval=3550878790 TSecr=1177858085
    335 0.250292083    192.168.1.1           192.168.1.2           TCP      1514   19 → 53762 [ACK] Seq=285331 Ack=1 Win=227 Len=1448 TSval=3550878791 TSecr=1177858085
    337 0.251544373    192.168.1.1           192.168.1.2           TCP      1514   19 → 53762 [ACK] Seq=286779 Ack=1 Win=227 Len=1448 TSval=3550878792 TSecr=1177858088
    338 0.252793974    192.168.1.1           192.168.1.2           TCP      1514   19 → 53762 [ACK] Seq=288227 Ack=1 Win=227 Len=1448 TSval=3550878793 TSecr=1177858088
    340 0.254044190    192.168.1.1           192.168.1.2           TCP      1514   19 → 53762 [ACK] Seq=289675 Ack=1 Win=227 Len=1448 TSval=3550878794 TSecr=1177858090
    341 0.255294152    192.168.1.1           192.168.1.2           TCP      1514   19 → 53762 [ACK] Seq=291123 Ack=1 Win=227 Len=1448 TSval=3550878796 TSecr=1177858090
    343 0.256543262    192.168.1.1           192.168.1.2           TCP      1514   19 → 53762 [ACK] Seq=292571 Ack=1 Win=227 Len=1448 TSval=3550878797 TSecr=1177858092
    344 0.257793808    192.168.1.1           192.168.1.2           TCP      1514   19 → 53762 [PSH, ACK] Seq=294019 Ack=1 Win=227 Len=1448 TSval=3550878798 TSecr=1177858092
    346 0.259045346    192.168.1.1           192.168.1.2           TCP      1514   19 → 53762 [ACK] Seq=295467 Ack=1 Win=227 Len=1448 TSval=3550878799 TSecr=1177858095
    347 0.260294543    192.168.1.1           192.168.1.2           TCP      1514   19 → 53762 [ACK] Seq=296915 Ack=1 Win=227 Len=1448 TSval=3550878801 TSecr=1177858095
    349 0.261545324    192.168.1.1           192.168.1.2           TCP      1514   19 → 53762 [ACK] Seq=298363 Ack=1 Win=227 Len=1448 TSval=3550878802 TSecr=1177858097
    350 0.262793940    192.168.1.1           192.168.1.2           TCP      1514   19 → 53762 [ACK] Seq=299811 Ack=1 Win=227 Len=1448 TSval=3550878803 TSecr=1177858097
    352 0.263791566    192.168.1.1           192.168.1.2           TCP      1514   19 → 53762 [ACK] Seq=301259 Ack=1 Win=227 Len=1448 TSval=3550878804 TSecr=1177858100
    353 0.265042705    192.168.1.1           192.168.1.2           TCP      1514   19 → 53762 [ACK] Seq=302707 Ack=1 Win=227 Len=1448 TSval=3550878806 TSecr=1177858100
    355 0.266294854    192.168.1.1           192.168.1.2           TCP      1514   19 → 53762 [ACK] Seq=304155 Ack=1 Win=227 Len=1448 TSval=3550878807 TSecr=1177858102
    356 0.267542828    192.168.1.1           192.168.1.2           TCP      1514   19 → 53762 [PSH, ACK] Seq=305603 Ack=1 Win=227 Len=1448 TSval=3550878808 TSecr=1177858102
    358 0.268793823    192.168.1.1           192.168.1.2           TCP      1514   19 → 53762 [ACK] Seq=307051 Ack=1 Win=227 Len=1448 TSval=3550878809 TSecr=1177858105
    359 0.270044122    192.168.1.1           192.168.1.2           TCP      1514   19 → 53762 [ACK] Seq=308499 Ack=1 Win=227 Len=1448 TSval=3550878811 TSecr=1177858105
    361 0.271299801    192.168.1.1           192.168.1.2           TCP      1514   19 → 53762 [ACK] Seq=309947 Ack=1 Win=227 Len=1448 TSval=3550878812 TSecr=1177858107
    362 0.272545131    192.168.1.1           192.168.1.2           TCP      1514   19 → 53762 [ACK] Seq=311395 Ack=1 Win=227 Len=1448 TSval=3550878813 TSecr=1177858107
    364 0.273773213    192.168.1.1           192.168.1.2           TCP      1514   19 → 53762 [ACK] Seq=312843 Ack=1 Win=227 Len=1448 TSval=3550878814 TSecr=1177858110
    365 0.275053251    192.168.1.1           192.168.1.2           TCP      1514   19 → 53762 [ACK] Seq=314291 Ack=1 Win=227 Len=1448 TSval=3550878815 TSecr=1177858110
    367 0.276301533    192.168.1.1           192.168.1.2           TCP      1514   19 → 53762 [ACK] Seq=315739 Ack=1 Win=227 Len=1448 TSval=3550878817 TSecr=1177858112
    368 0.277548753    192.168.1.1           192.168.1.2           TCP      1514   19 → 53762 [PSH, ACK] Seq=317187 Ack=1 Win=227 Len=1448 TSval=3550878818 TSecr=1177858112
    370 0.278787149    192.168.1.1           192.168.1.2           TCP      1514   19 → 53762 [ACK] Seq=318635 Ack=1 Win=227 Len=1448 TSval=3550878819 TSecr=1177858115
    371 0.280029515    192.168.1.1           192.168.1.2           TCP      1514   19 → 53762 [PSH, ACK] Seq=320083 Ack=1 Win=227 Len=1448 TSval=3550878821 TSecr=1177858115
    373 0.281278161    192.168.1.1           192.168.1.2           TCP      1514   19 → 53762 [ACK] Seq=321531 Ack=1 Win=227 Len=1448 TSval=3550878821 TSecr=1177858117
    374 0.282310038    192.168.1.1           192.168.1.2           TCP      1514   19 → 53762 [ACK] Seq=322979 Ack=1 Win=227 Len=1448 TSval=3550878823 TSecr=1177858117
    376 0.283551845    192.168.1.1           192.168.1.2           TCP      1514   19 → 53762 [ACK] Seq=324427 Ack=1 Win=227 Len=1448 TSval=3550878824 TSecr=1177858120
    377 0.284802405    192.168.1.1           192.168.1.2           TCP      1514   19 → 53762 [ACK] Seq=325875 Ack=1 Win=227 Len=1448 TSval=3550878825 TSecr=1177858120
    379 0.286052674    192.168.1.1           192.168.1.2           TCP      1514   19 → 53762 [ACK] Seq=327323 Ack=1 Win=227 Len=1448 TSval=3550878827 TSecr=1177858122
    380 0.287301509    192.168.1.1           192.168.1.2           TCP      1514   19 → 53762 [PSH, ACK] Seq=328771 Ack=1 Win=227 Len=1448 TSval=3550878828 TSecr=1177858122
    382 0.288527298    192.168.1.1           192.168.1.2           TCP      1514   19 → 53762 [ACK] Seq=330219 Ack=1 Win=227 Len=1448 TSval=3550878829 TSecr=1177858125
    383 0.289803675    192.168.1.1           192.168.1.2           TCP      1514   19 → 53762 [ACK] Seq=331667 Ack=1 Win=227 Len=1448 TSval=3550878830 TSecr=1177858125
    385 0.291053299    192.168.1.1           192.168.1.2           TCP      1514   19 → 53762 [ACK] Seq=333115 Ack=1 Win=227 Len=1448 TSval=3550878832 TSecr=1177858127
    386 0.292303946    192.168.1.1           192.168.1.2           TCP      1514   19 → 53762 [ACK] Seq=334563 Ack=1 Win=227 Len=1448 TSval=3550878833 TSecr=1177858127
    388 0.293551395    192.168.1.1           192.168.1.2           TCP      1514   19 → 53762 [ACK] Seq=336011 Ack=1 Win=227 Len=1448 TSval=3550878834 TSecr=1177858129
    389 0.294803849    192.168.1.1           192.168.1.2           TCP      1514   19 → 53762 [ACK] Seq=337459 Ack=1 Win=227 Len=1448 TSval=3550878835 TSecr=1177858129
    391 0.296029730    192.168.1.1           192.168.1.2           TCP      1514   19 → 53762 [ACK] Seq=338907 Ack=1 Win=227 Len=1448 TSval=3550878837 TSecr=1177858132
