      3 0.259896490    192.168.1.2           192.168.1.1           TCP      58     36454 → 80 [SYN] Seq=0 Win=1024 Len=0 MSS=1460
      4 0.259921075    192.168.1.2           192.168.1.1           TCP      58     36454 → 23 [SYN] Seq=0 Win=1024 Len=0 MSS=1460
      5 0.259931867    192.168.1.2           192.168.1.1           TCP      58     36454 → 53 [SYN] Seq=0 Win=1024 Len=0 MSS=1460
      6 0.259941785    192.168.1.2           192.168.1.1           TCP      58     36454 → 22 [SYN] Seq=0 Win=1024 Len=0 MSS=1460
      7 0.259951211    192.168.1.2           192.168.1.1           TCP      58     36454 → 21 [SYN] Seq=0 Win=1024 Len=0 MSS=1460
      8 0.259960688    192.168.1.2           192.168.1.1           TCP      58     36454 → 25 [SYN] Seq=0 Win=1024 Len=0 MSS=1460
      9 0.259971126    192.168.1.2           192.168.1.1           TCP      58     36454 → 9 [SYN] Seq=0 Win=1024 Len=0 MSS=1460
     10 0.259980603    192.168.1.2           192.168.1.1           TCP      58     36454 → 38 [SYN] Seq=0 Win=1024 Len=0 MSS=1460
     11 0.259990696    192.168.1.2           192.168.1.1           TCP      58     36454 → 45 [SYN] Seq=0 Win=1024 Len=0 MSS=1460
     12 0.260001881    192.168.1.2           192.168.1.1           TCP      58     36454 → 17 [SYN] Seq=0 Win=1024 Len=0 MSS=1460
     17 0.261021595    192.168.1.2           192.168.1.1           TCP      54     36454 → 22 [RST] Seq=1 Win=0 Len=0
     24 1.361090514    192.168.1.2           192.168.1.1           TCP      58     36454 → 95 [SYN] Seq=0 Win=1024 Len=0 MSS=1460
     25 1.361117792    192.168.1.2           192.168.1.1           TCP      58     36454 → 39 [SYN] Seq=0 Win=1024 Len=0 MSS=1460
     26 1.361128052    192.168.1.2           192.168.1.1           TCP      58     36454 → 52 [SYN] Seq=0 Win=1024 Len=0 MSS=1460
     27 1.361137290    192.168.1.2           192.168.1.1           TCP      58     36454 → 77 [SYN] Seq=0 Win=1024 Len=0 MSS=1460
     28 1.361146794    192.168.1.2           192.168.1.1           TCP      58     36454 → 32 [SYN] Seq=0 Win=1024 Len=0 MSS=1460
     29 1.361156566    192.168.1.2           192.168.1.1           TCP      58     36454 → 24 [SYN] Seq=0 Win=1024 Len=0 MSS=1460
     30 1.361166338    192.168.1.2           192.168.1.1           TCP      58     36454 → 31 [SYN] Seq=0 Win=1024 Len=0 MSS=1460
     31 1.361177547    192.168.1.2           192.168.1.1           TCP      58     36454 → 98 [SYN] Seq=0 Win=1024 Len=0 MSS=1460
     32 1.361188572    192.168.1.2           192.168.1.1           TCP      58     36454 → 64 [SYN] Seq=0 Win=1024 Len=0 MSS=1460
     33 1.361199293    192.168.1.2           192.168.1.1           TCP      58     36454 → 92 [SYN] Seq=0 Win=1024 Len=0 MSS=1460
     34 1.361209539    192.168.1.2           192.168.1.1           TCP      58     36454 → 16 [SYN] Seq=0 Win=1024 Len=0 MSS=1460
     35 1.361219091    192.168.1.2           192.168.1.1           TCP      58     36454 → 28 [SYN] Seq=0 Win=1024 Len=0 MSS=1460
     36 1.361229184    192.168.1.2           192.168.1.1           TCP      58     36454 → 96 [SYN] Seq=0 Win=1024 Len=0 MSS=1460
     37 1.361238943    192.168.1.2           192.168.1.1           TCP      58     36454 → 50 [SYN] Seq=0 Win=1024 Len=0 MSS=1460
     38 1.361248374    192.168.1.2           192.168.1.1           TCP      58     36454 → 60 [SYN] Seq=0 Win=1024 Len=0 MSS=1460
     39 1.361257929    192.168.1.2           192.168.1.1           TCP      58     36454 → 14 [SYN] Seq=0 Win=1024 Len=0 MSS=1460
     40 1.361268076    192.168.1.2           192.168.1.1           TCP      58     36454 → 66 [SYN] Seq=0 Win=1024 Len=0 MSS=1460
     41 1.361278379    192.168.1.2           192.168.1.1           TCP      58     36454 → 12 [SYN] Seq=0 Win=1024 Len=0 MSS=1460
     42 1.361289821    192.168.1.2           192.168.1.1           TCP      58     36454 → 49 [SYN] Seq=0 Win=1024 Len=0 MSS=1460
     43 1.361299420    192.168.1.2           192.168.1.1           TCP      58     36454 → 76 [SYN] Seq=0 Win=1024 Len=0 MSS=1460
     44 1.361309643    192.168.1.2           192.168.1.1           TCP      58     36454 → 41 [SYN] Seq=0 Win=1024 Len=0 MSS=1460
     45 1.361341589    192.168.1.2           192.168.1.1           TCP      58     36454 → 65 [SYN] Seq=0 Win=1024 Len=0 MSS=1460
     46 1.361352026    192.168.1.2           192.168.1.1           TCP      58     36454 → 59 [SYN] Seq=0 Win=1024 Len=0 MSS=1460
     47 1.361354041    192.168.1.2           192.168.1.1           TCP      58     36454 → 67 [SYN] Seq=0 Win=1024 Len=0 MSS=1460
     48 1.361355514    192.168.1.2           192.168.1.1           TCP      58     36454 → 87 [SYN] Seq=0 Win=1024 Len=0 MSS=1460
     49 1.361357699    192.168.1.2           192.168.1.1           TCP      58     36454 → 43 [SYN] Seq=0 Win=1024 Len=0 MSS=1460
     50 1.361362493    192.168.1.2           192.168.1.1           TCP      58     36454 → 18 [SYN] Seq=0 Win=1024 Len=0 MSS=1460
     51 1.361374122    192.168.1.2           192.168.1.1           TCP      58     36454 → 97 [SYN] Seq=0 Win=1024 Len=0 MSS=1460
     52 1.361382882    192.168.1.2           192.168.1.1           TCP      58     36454 → 26 [SYN] Seq=0 Win=1024 Len=0 MSS=1460
     53 1.361392090    192.168.1.2           192.168.1.1           TCP      58     36454 → 100 [SYN] Seq=0 Win=1024 Len=0 MSS=1460
     54 1.361401591    192.168.1.2           192.168.1.1           TCP      58     36454 → 37 [SYN] Seq=0 Win=1024 Len=0 MSS=1460
     55 1.361412128    192.168.1.2           192.168.1.1           TCP      58     36454 → 11 [SYN] Seq=0 Win=1024 Len=0 MSS=1460
     56 1.361422382    192.168.1.2           192.168.1.1           TCP      58     36454 → 34 [SYN] Seq=0 Win=1024 Len=0 MSS=1460
     57 1.361432291    192.168.1.2           192.168.1.1           TCP      58     36454 → 56 [SYN] Seq=0 Win=1024 Len=0 MSS=1460
     58 1.361441328    192.168.1.2           192.168.1.1           TCP      58     36454 → 51 [SYN] Seq=0 Win=1024 Len=0 MSS=1460
     59 1.361450131    192.168.1.2           192.168.1.1           TCP      58     36454 → 69 [SYN] Seq=0 Win=1024 Len=0 MSS=1460
     60 1.361459129    192.168.1.2           192.168.1.1           TCP      58     36454 → 55 [SYN] Seq=0 Win=1024 Len=0 MSS=1460
     61 1.361467681    192.168.1.2           192.168.1.1           TCP      58     36454 → 10 [SYN] Seq=0 Win=1024 Len=0 MSS=1460
     62 1.361477233    192.168.1.2           192.168.1.1           TCP      58     36454 → 94 [SYN] Seq=0 Win=1024 Len=0 MSS=1460
     63 1.361486126    192.168.1.2           192.168.1.1           TCP      58     36454 → 89 [SYN] Seq=0 Win=1024 Len=0 MSS=1460
     64 1.361495234    192.168.1.2           192.168.1.1           TCP      58     36454 → 36 [SYN] Seq=0 Win=1024 Len=0 MSS=1460
     65 1.361504137    192.168.1.2           192.168.1.1           TCP      58     36454 → 99 [SYN] Seq=0 Win=1024 Len=0 MSS=1460
     66 1.361512493    192.168.1.2           192.168.1.1           TCP      58     36454 → 20 [SYN] Seq=0 Win=1024 Len=0 MSS=1460
     67 1.361521734    192.168.1.2           192.168.1.1           TCP      58     36454 → 85 [SYN] Seq=0 Win=1024 Len=0 MSS=1460
     68 1.361531208    192.168.1.2           192.168.1.1           TCP      58     36454 → 6 [SYN] Seq=0 Win=1024 Len=0 MSS=1460
     69 1.361541676    192.168.1.2           192.168.1.1           TCP      58     36454 → 8 [SYN] Seq=0 Win=1024 Len=0 MSS=1460
     70 1.361551852    192.168.1.2           192.168.1.1           TCP      58     36454 → 61 [SYN] Seq=0 Win=1024 Len=0 MSS=1460
     71 1.361561694    192.168.1.2           192.168.1.1           TCP      58     36454 → 2 [SYN] Seq=0 Win=1024 Len=0 MSS=1460
     72 1.361574804    192.168.1.2           192.168.1.1           TCP      58     36454 → 79 [SYN] Seq=0 Win=1024 Len=0 MSS=1460
     73 1.361586170    192.168.1.2           192.168.1.1           TCP      58     36454 → 4 [SYN] Seq=0 Win=1024 Len=0 MSS=1460
     99 1.363740968    192.168.1.2           192.168.1.1           TCP      58     36454 → 75 [SYN] Seq=0 Win=1024 Len=0 MSS=1460
    100 1.363763104    192.168.1.2           192.168.1.1           TCP      58     36454 → 13 [SYN] Seq=0 Win=1024 Len=0 MSS=1460
    101 1.363776161    192.168.1.2           192.168.1.1           TCP      58     36454 → 54 [SYN] Seq=0 Win=1024 Len=0 MSS=1460
    102 1.363785856    192.168.1.2           192.168.1.1           TCP      58     36454 → 91 [SYN] Seq=0 Win=1024 Len=0 MSS=1460
    103 1.363794786    192.168.1.2           192.168.1.1           TCP      58     36454 → 42 [SYN] Seq=0 Win=1024 Len=0 MSS=1460
    104 1.363804044    192.168.1.2           192.168.1.1           TCP      58     36454 → 35 [SYN] Seq=0 Win=1024 Len=0 MSS=1460
    105 1.363815377    192.168.1.2           192.168.1.1           TCP      58     36454 → 27 [SYN] Seq=0 Win=1024 Len=0 MSS=1460
    106 1.363827280    192.168.1.2           192.168.1.1           TCP      58     36454 → 30 [SYN] Seq=0 Win=1024 Len=0 MSS=1460
    108 1.363840066    192.168.1.2           192.168.1.1           TCP      58     36454 → 74 [SYN] Seq=0 Win=1024 Len=0 MSS=1460
    110 1.363852968    192.168.1.2           192.168.1.1           TCP      58     36454 → 70 [SYN] Seq=0 Win=1024 Len=0 MSS=1460
    113 1.363863870    192.168.1.2           192.168.1.1           TCP      58     36454 → 82 [SYN] Seq=0 Win=1024 Len=0 MSS=1460
    114 1.363876615    192.168.1.2           192.168.1.1           TCP      58     36454 → 63 [SYN] Seq=0 Win=1024 Len=0 MSS=1460
    115 1.363888983    192.168.1.2           192.168.1.1           TCP      58     36454 → 44 [SYN] Seq=0 Win=1024 Len=0 MSS=1460
    116 1.363898014    192.168.1.2           192.168.1.1           TCP      58     36454 → 3 [SYN] Seq=0 Win=1024 Len=0 MSS=1460
    117 1.363907321    192.168.1.2           192.168.1.1           TCP      58     36454 → 84 [SYN] Seq=0 Win=1024 Len=0 MSS=1460
    118 1.363916699    192.168.1.2           192.168.1.1           TCP      58     36454 → 83 [SYN] Seq=0 Win=1024 Len=0 MSS=1460
    119 1.363926161    192.168.1.2           192.168.1.1           TCP      58     36454 → 93 [SYN] Seq=0 Win=1024 Len=0 MSS=1460
    120 1.363935629    192.168.1.2           192.168.1.1           TCP      58     36454 → 46 [SYN] Seq=0 Win=1024 Len=0 MSS=1460
    121 1.363946236    192.168.1.2           192.168.1.1           TCP      58     36454 → 48 [SYN] Seq=0 Win=1024 Len=0 MSS=1460
    122 1.363955537    192.168.1.2           192.168.1.1           TCP      58     36454 → 40 [SYN] Seq=0 Win=1024 Len=0 MSS=1460
    123 1.363966662    192.168.1.2           192.168.1.1           TCP      58     36454 → 68 [SYN] Seq=0 Win=1024 Len=0 MSS=1460
    124 1.363976758    192.168.1.2           192.168.1.1           TCP      58     36454 → 72 [SYN] Seq=0 Win=1024 Len=0 MSS=1460
    125 1.363985913    192.168.1.2           192.168.1.1           TCP      58     36454 → 7 [SYN] Seq=0 Win=1024 Len=0 MSS=1460
    126 1.363995405    192.168.1.2           192.168.1.1           TCP      58     36454 → 86 [SYN] Seq=0 Win=1024 Len=0 MSS=1460
    127 1.364006232    192.168.1.2           192.168.1.1           TCP      58     36454 → 19 [SYN] Seq=0 Win=1024 Len=0 MSS=1460
    128 1.364016388    192.168.1.2           192.168.1.1           TCP      58     36454 → 88 [SYN] Seq=0 Win=1024 Len=0 MSS=1460
    129 1.364026401    192.168.1.2           192.168.1.1           TCP      58     36454 → 29 [SYN] Seq=0 Win=1024 Len=0 MSS=1460
    130 1.364036050    192.168.1.2           192.168.1.1           TCP      58     36454 → 15 [SYN] Seq=0 Win=1024 Len=0 MSS=1460
    131 1.364045468    192.168.1.2           192.168.1.1           TCP      58     36454 → 78 [SYN] Seq=0 Win=1024 Len=0 MSS=1460
    132 1.364055133    192.168.1.2           192.168.1.1           TCP      58     36454 → 62 [SYN] Seq=0 Win=1024 Len=0 MSS=1460
    133 1.364067017    192.168.1.2           192.168.1.1           TCP      58     36454 → 58 [SYN] Seq=0 Win=1024 Len=0 MSS=1460
    134 1.364079037    192.168.1.2           192.168.1.1           TCP      58     36454 → 90 [SYN] Seq=0 Win=1024 Len=0 MSS=1460
    135 1.364090683    192.168.1.2           192.168.1.1           TCP      58     36454 → 57 [SYN] Seq=0 Win=1024 Len=0 MSS=1460
    137 1.364101732    192.168.1.2           192.168.1.1           TCP      58     36454 → 33 [SYN] Seq=0 Win=1024 Len=0 MSS=1460
    140 1.364112680    192.168.1.2           192.168.1.1           TCP      58     36454 → 1 [SYN] Seq=0 Win=1024 Len=0 MSS=1460
    142 1.364124660    192.168.1.2           192.168.1.1           TCP      58     36454 → 71 [SYN] Seq=0 Win=1024 Len=0 MSS=1460
    143 1.364135278    192.168.1.2           192.168.1.1           TCP      58     36454 → 73 [SYN] Seq=0 Win=1024 Len=0 MSS=1460
    144 1.364144141    192.168.1.2           192.168.1.1           TCP      58     36454 → 47 [SYN] Seq=0 Win=1024 Len=0 MSS=1460
    145 1.364153078    192.168.1.2           192.168.1.1           TCP      58     36454 → 5 [SYN] Seq=0 Win=1024 Len=0 MSS=1460
    146 1.364161781    192.168.1.2           192.168.1.1           TCP      58     36454 → 81 [SYN] Seq=0 Win=1024 Len=0 MSS=1460
    187 1.367076485    192.168.1.2           192.168.1.1           TCP      54     36454 → 7 [RST] Seq=1 Win=0 Len=0
    190 1.367104304    192.168.1.2           192.168.1.1           TCP      54     36454 → 19 [RST] Seq=1 Win=0 Len=0
