      1 0.000000000    192.168.1.2           192.168.1.1           TCP      74     53762 → 19 [SYN] Seq=0 Win=29200 Len=0 MSS=1460 SACK_PERM=1[Packet size limited during capture]
      3 0.001163513    192.168.1.2           192.168.1.1           TCP      66     53762 → 19 [ACK] Seq=1 Ack=1 Win=229 Len=0 TSval=1177857848 TSecr=3550878551
      5 0.002921471    192.168.1.2           192.168.1.1           TCP      66     53762 → 19 [ACK] Seq=1 Ack=75 Win=229 Len=0 TSval=1177857850 TSecr=3550878552
      7 0.007535248    192.168.1.2           192.168.1.1           TCP      66     53762 → 19 [ACK] Seq=1 Ack=1523 Win=251 Len=0 TSval=1177857854 TSecr=3550878552
      9 0.008742352    192.168.1.2           192.168.1.1           TCP      66     53762 → 19 [ACK] Seq=1 Ack=2971 Win=274 Len=0 TSval=1177857856 TSecr=3550878552
     11 0.009801668    192.168.1.2           192.168.1.1           TCP      66     53762 → 19 [ACK] Seq=1 Ack=4419 Win=296 Len=0 TSval=1177857857 TSecr=3550878552
     13 0.011079991    192.168.1.2           192.168.1.1           TCP      66     53762 → 19 [ACK] Seq=1 Ack=5867 Win=319 Len=0 TSval=1177857858 TSecr=3550878553
     15 0.012295775    192.168.1.2           192.168.1.1           TCP      66     53762 → 19 [ACK] Seq=1 Ack=7315 Win=342 Len=0 TSval=1177857859 TSecr=3550878553
     17 0.013524564    192.168.1.2           192.168.1.1           TCP      66     53762 → 19 [ACK] Seq=1 Ack=8763 Win=364 Len=0 TSval=1177857860 TSecr=3550878553
     19 0.014761832    192.168.1.2           192.168.1.1           TCP      66     53762 → 19 [ACK] Seq=1 Ack=10211 Win=387 Len=0 TSval=1177857862 TSecr=3550878553
     21 0.015994371    192.168.1.2           192.168.1.1           TCP      66     53762 → 19 [ACK] Seq=1 Ack=11659 Win=410 Len=0 TSval=1177857863 TSecr=3550878554
     23 0.017284467    192.168.1.2           192.168.1.1           TCP      66     53762 → 19 [ACK] Seq=1 Ack=13107 Win=432 Len=0 TSval=1177857864 TSecr=3550878555
     25 0.018546733    192.168.1.2           192.168.1.1           TCP      66     53762 → 19 [ACK] Seq=1 Ack=14555 Win=455 Len=0 TSval=1177857866 TSecr=3550878556
     27 0.019834862    192.168.1.2           192.168.1.1           TCP      66     53762 → 19 [ACK] Seq=1 Ack=16003 Win=477 Len=0 TSval=1177857867 TSecr=3550878559
     29 0.021084789    192.168.1.2           192.168.1.1           TCP      66     53762 → 19 [ACK] Seq=1 Ack=17451 Win=500 Len=0 TSval=1177857868 TSecr=3550878561
     31 0.022360334    192.168.1.2           192.168.1.1           TCP      66     53762 → 19 [ACK] Seq=1 Ack=18899 Win=523 Len=0 TSval=1177857869 TSecr=3550878563
     33 0.023530768    192.168.1.2           192.168.1.1           TCP      66     53762 → 19 [ACK] Seq=1 Ack=20347 Win=545 Len=0 TSval=1177857870 TSecr=3550878564
     35 0.024777246    192.168.1.2           192.168.1.1           TCP      66     53762 → 19 [ACK] Seq=1 Ack=21795 Win=568 Len=0 TSval=1177857872 TSecr=3550878565
     37 0.026012755    192.168.1.2           192.168.1.1           TCP      66     53762 → 19 [ACK] Seq=1 Ack=23243 Win=591 Len=0 TSval=1177857873 TSecr=3550878566
     39 0.027242652    192.168.1.2           192.168.1.1           TCP      66     53762 → 19 [ACK] Seq=1 Ack=24691 Win=613 Len=0 TSval=1177857874 TSecr=3550878568
     41 0.028270874    192.168.1.2           192.168.1.1           TCP      66     53762 → 19 [ACK] Seq=1 Ack=26139 Win=636 Len=0 TSval=1177857875 TSecr=3550878569
     43 0.029534173    192.168.1.2           192.168.1.1           TCP      66     53762 → 19 [ACK] Seq=1 Ack=27587 Win=658 Len=0 TSval=1177857876 TSecr=3550878570
     45 0.030731220    192.168.1.2           192.168.1.1           TCP      66     53762 → 19 [ACK] Seq=1 Ack=29035 Win=681 Len=0 TSval=1177857878 TSecr=3550878571
     47 0.032004601    192.168.1.2           192.168.1.1           TCP      66     53762 → 19 [ACK] Seq=1 Ack=30483 Win=704 Len=0 TSval=1177857879 TSecr=3550878572
     49 0.033249926    192.168.1.2           192.168.1.1           TCP      66     53762 → 19 [ACK] Seq=1 Ack=31931 Win=726 Len=0 TSval=1177857880 TSecr=3550878574
     51 0.034493019    192.168.1.2           192.168.1.1           TCP      66     53762 → 19 [ACK] Seq=1 Ack=33379 Win=749 Len=0 TSval=1177857881 TSecr=3550878575
     53 0.035777485    192.168.1.2           192.168.1.1           TCP      66     53762 → 19 [ACK] Seq=1 Ack=34827 Win=772 Len=0 TSval=1177857883 TSecr=3550878576
     55 0.037035806    192.168.1.2           192.168.1.1           TCP      66     53762 → 19 [ACK] Seq=1 Ack=36275 Win=794 Len=0 TSval=1177857884 TSecr=3550878577
     57 0.038252632    192.168.1.2           192.168.1.1           TCP      66     53762 → 19 [ACK] Seq=1 Ack=37723 Win=817 Len=0 TSval=1177857885 TSecr=3550878579
     59 0.039493400    192.168.1.2           192.168.1.1           TCP      66     53762 → 19 [ACK] Seq=1 Ack=39171 Win=839 Len=0 TSval=1177857886 TSecr=3550878580
     61 0.040787645    192.168.1.2           192.168.1.1           TCP      66     53762 → 19 [ACK] Seq=1 Ack=40619 Win=862 Len=0 TSval=1177857888 TSecr=3550878581
     63 0.042018323    192.168.1.2           192.168.1.1           TCP      66     53762 → 19 [ACK] Seq=1 Ack=42067 Win=885 Len=0 TSval=1177857889 TSecr=3550878582
     65 0.043259151    192.168.1.2           192.168.1.1           TCP      66     53762 → 19 [ACK] Seq=1 Ack=43515 Win=907 Len=0 TSval=1177857890 TSecr=3550878584
     67 0.044590129    192.168.1.2           192.168.1.1           TCP      66     53762 → 19 [ACK] Seq=1 Ack=44963 Win=930 Len=0 TSval=1177857892 TSecr=3550878585
     69 0.045801494    192.168.1.2           192.168.1.1           TCP      66     53762 → 19 [ACK] Seq=1 Ack=46411 Win=953 Len=0 TSval=1177857893 TSecr=3550878586
     71 0.046780431    192.168.1.2           192.168.1.1           TCP      66     53762 → 19 [ACK] Seq=1 Ack=47859 Win=975 Len=0 TSval=1177857894 TSecr=3550878587
     73 0.048030664    192.168.1.2           192.168.1.1           TCP      66     53762 → 19 [ACK] Seq=1 Ack=49307 Win=998 Len=0 TSval=1177857895 TSecr=3550878588
     75 0.049278625    192.168.1.2           192.168.1.1           TCP      66     53762 → 19 [ACK] Seq=1 Ack=50755 Win=1020 Len=0 TSval=1177857896 TSecr=3550878590
     77 0.050536691    192.168.1.2           192.168.1.1           TCP      66     53762 → 19 [ACK] Seq=1 Ack=52203 Win=1043 Len=0 TSval=1177857897 TSecr=3550878591
     79 0.051803738    192.168.1.2           192.168.1.1           TCP      66     53762 → 19 [ACK] Seq=1 Ack=53651 Win=1066 Len=0 TSval=1177857899 TSecr=3550878592
     81 0.053046050    192.168.1.2           192.168.1.1           TCP      66     53762 → 19 [ACK] Seq=1 Ack=55099 Win=1088 Len=0 TSval=1177857900 TSecr=3550878593
     83 0.054269939    192.168.1.2           192.168.1.1           TCP      66     53762 → 19 [ACK] Seq=1 Ack=56547 Win=1111 Len=0 TSval=1177857901 TSecr=3550878595
     85 0.055519874    192.168.1.2           192.168.1.1           TCP      66     53762 → 19 [ACK] Seq=1 Ack=57995 Win=1134 Len=0 TSval=1177857902 TSecr=3550878596
     87 0.056798213    192.168.1.2           192.168.1.1           TCP      66     53762 → 19 [ACK] Seq=1 Ack=59443 Win=1156 Len=0 TSval=1177857904 TSecr=3550878597
     89 0.058020034    192.168.1.2           192.168.1.1           TCP      66     53762 → 19 [ACK] Seq=1 Ack=60891 Win=1179 Len=0 TSval=1177857905 TSecr=3550878598
     91 0.059266518    192.168.1.2           192.168.1.1           TCP      66     53762 → 19 [ACK] Seq=1 Ack=62339 Win=1201 Len=0 TSval=1177857906 TSecr=3550878600
     93 0.060515171    192.168.1.2           192.168.1.1           TCP      66     53762 → 19 [ACK] Seq=1 Ack=63787 Win=1224 Len=0 TSval=1177857907 TSecr=3550878601
     95 0.061786060    192.168.1.2           192.168.1.1           TCP      66     53762 → 19 [ACK] Seq=1 Ack=65235 Win=1247 Len=0 TSval=1177857909 TSecr=3550878602
     97 0.063010744    192.168.1.2           192.168.1.1           TCP      66     53762 → 19 [ACK] Seq=1 Ack=66683 Win=1269 Len=0 TSval=1177857910 TSecr=3550878603
     99 0.064249183    192.168.1.2           192.168.1.1           TCP      66     53762 → 19 [ACK] Seq=1 Ack=68131 Win=1292 Len=0 TSval=1177857911 TSecr=3550878604
    101 0.065247949    192.168.1.2           192.168.1.1           TCP      66     53762 → 19 [ACK] Seq=1 Ack=69579 Win=1315 Len=0 TSval=1177857912 TSecr=3550878606
    103 0.066501158    192.168.1.2           192.168.1.1           TCP      66     53762 → 19 [ACK] Seq=1 Ack=71027 Win=1337 Len=0 TSval=1177857913 TSecr=3550878607
    105 0.067757100    192.168.1.2           192.168.1.1           TCP      66     53762 → 19 [ACK] Seq=1 Ack=72475 Win=1360 Len=0 TSval=1177857915 TSecr=3550878608
    107 0.068994951    192.168.1.2           192.168.1.1           TCP      66     53762 → 19 [ACK] Seq=1 Ack=73923 Win=1382 Len=0 TSval=1177857916 TSecr=3550878609
    109 0.070233249    192.168.1.2           192.168.1.1           TCP      66     53762 → 19 [ACK] Seq=1 Ack=75371 Win=1405 Len=0 TSval=1177857917 TSecr=3550878611
    111 0.071490257    192.168.1.2           192.168.1.1           TCP      66     53762 → 19 [ACK] Seq=1 Ack=76819 Win=1428 Len=0 TSval=1177857918 TSecr=3550878612
    113 0.072739775    192.168.1.2           192.168.1.1           TCP      66     53762 → 19 [ACK] Seq=1 Ack=78267 Win=1444 Len=0 TSval=1177857920 TSecr=3550878613
    115 0.073980036    192.168.1.2           192.168.1.1           TCP      66     53762 → 19 [ACK] Seq=1 Ack=79715 Win=1444 Len=0 TSval=1177857921 TSecr=3550878615
    117 0.075259409    192.168.1.2           192.168.1.1           TCP      66     53762 → 19 [ACK] Seq=1 Ack=81163 Win=1444 Len=0 TSval=1177857922 TSecr=3550878616
    119 0.076499716    192.168.1.2           192.168.1.1           TCP      66     53762 → 19 [ACK] Seq=1 Ack=82611 Win=1444 Len=0 TSval=1177857923 TSecr=3550878617
    121 0.077739127    192.168.1.2           192.168.1.1           TCP      66     53762 → 19 [ACK] Seq=1 Ack=84059 Win=1444 Len=0 TSval=1177857925 TSecr=3550878618
    123 0.079026193    192.168.1.2           192.168.1.1           TCP      66     53762 → 19 [ACK] Seq=1 Ack=85507 Win=1444 Len=0 TSval=1177857926 TSecr=3550878619
    125 0.080330551    192.168.1.2           192.168.1.1           TCP      66     53762 → 19 [ACK] Seq=1 Ack=86955 Win=1444 Len=0 TSval=1177857927 TSecr=3550878621
    127 0.081546659    192.168.1.2           192.168.1.1           TCP      66     53762 → 19 [ACK] Seq=1 Ack=88403 Win=1444 Len=0 TSval=1177857928 TSecr=3550878622
    129 0.082514100    192.168.1.2           192.168.1.1           TCP      66     53762 → 19 [ACK] Seq=1 Ack=89851 Win=1444 Len=0 TSval=1177857929 TSecr=3550878623
    131 0.083757062    192.168.1.2           192.168.1.1           TCP      66     53762 → 19 [ACK] Seq=1 Ack=91299 Win=1444 Len=0 TSval=1177857931 TSecr=3550878624
    133 0.085006019    192.168.1.2           192.168.1.1           TCP      66     53762 → 19 [ACK] Seq=1 Ack=92747 Win=1444 Len=0 TSval=1177857932 TSecr=3550878626
    135 0.086249305    192.168.1.2           192.168.1.1           TCP      66     53762 → 19 [ACK] Seq=1 Ack=94195 Win=1444 Len=0 TSval=1177857933 TSecr=3550878627
    137 0.087497572    192.168.1.2           192.168.1.1           TCP      66     53762 → 19 [ACK] Seq=1 Ack=95643 Win=1444 Len=0 TSval=1177857934 TSecr=3550878628
    139 0.088746962    192.168.1.2           192.168.1.1           TCP      66     53762 → 19 [ACK] Seq=1 Ack=97091 Win=1444 Len=0 TSval=1177857936 TSecr=3550878629
    141 0.089978625    192.168.1.2           192.168.1.1           TCP      66     53762 → 19 [ACK] Seq=1 Ack=98539 Win=1444 Len=0 TSval=1177857937 TSecr=3550878631
    144 0.092507662    192.168.1.2           192.168.1.1           TCP      66     53762 → 19 [ACK] Seq=1 Ack=101435 Win=1444 Len=0 TSval=1177857939 TSecr=3550878632
    147 0.095002767    192.168.1.2           192.168.1.1           TCP      66     53762 → 19 [ACK] Seq=1 Ack=104331 Win=1444 Len=0 TSval=1177857942 TSecr=3550878634
    150 0.097484842    192.168.1.2           192.168.1.1           TCP      66     53762 → 19 [ACK] Seq=1 Ack=107227 Win=1444 Len=0 TSval=1177857944 TSecr=3550878637
    153 0.100010622    192.168.1.2           192.168.1.1           TCP      66     53762 → 19 [ACK] Seq=1 Ack=110123 Win=1444 Len=0 TSval=1177857947 TSecr=3550878639
    156 0.102262542    192.168.1.2           192.168.1.1           TCP      66     53762 → 19 [ACK] Seq=1 Ack=113019 Win=1444 Len=0 TSval=1177857949 TSecr=3550878642
    159 0.104762612    192.168.1.2           192.168.1.1           TCP      66     53762 → 19 [ACK] Seq=1 Ack=115915 Win=1444 Len=0 TSval=1177857952 TSecr=3550878644
    162 0.107254370    192.168.1.2           192.168.1.1           TCP      66     53762 → 19 [ACK] Seq=1 Ack=118811 Win=1444 Len=0 TSval=1177857954 TSecr=3550878647
    165 0.109739601    192.168.1.2           192.168.1.1           TCP      66     53762 → 19 [ACK] Seq=1 Ack=121707 Win=1444 Len=0 TSval=1177857957 TSecr=3550878649
    168 0.112240016    192.168.1.2           192.168.1.1           TCP      66     53762 → 19 [ACK] Seq=1 Ack=124603 Win=1444 Len=0 TSval=1177857959 TSecr=3550878651
    171 0.114772319    192.168.1.2           192.168.1.1           TCP      66     53762 → 19 [ACK] Seq=1 Ack=127499 Win=1444 Len=0 TSval=1177857962 TSecr=3550878654
    174 0.117344296    192.168.1.2           192.168.1.1           TCP      66     53762 → 19 [ACK] Seq=1 Ack=130395 Win=1444 Len=0 TSval=1177857964 TSecr=3550878656
    177 0.119546080    192.168.1.2           192.168.1.1           TCP      66     53762 → 19 [ACK] Seq=1 Ack=133291 Win=1444 Len=0 TSval=1177857967 TSecr=3550878659
    180 0.122011088    192.168.1.2           192.168.1.1           TCP      66     53762 → 19 [ACK] Seq=1 Ack=136187 Win=1444 Len=0 TSval=1177857969 TSecr=3550878661
    183 0.124510980    192.168.1.2           192.168.1.1           TCP      66     53762 → 19 [ACK] Seq=1 Ack=139083 Win=1444 Len=0 TSval=1177857971 TSecr=3550878664
    186 0.127011687    192.168.1.2           192.168.1.1           TCP      66     53762 → 19 [ACK] Seq=1 Ack=141979 Win=1444 Len=0 TSval=1177857974 TSecr=3550878666
    189 0.129523992    192.168.1.2           192.168.1.1           TCP      66     53762 → 19 [ACK] Seq=1 Ack=144875 Win=1444 Len=0 TSval=1177857976 TSecr=3550878669
    192 0.132024256    192.168.1.2           192.168.1.1           TCP      66     53762 → 19 [ACK] Seq=1 Ack=147771 Win=1444 Len=0 TSval=1177857979 TSecr=3550878671
    195 0.134525287    192.168.1.2           192.168.1.1           TCP      66     53762 → 19 [ACK] Seq=1 Ack=150667 Win=1444 Len=0 TSval=1177857981 TSecr=3550878674
    198 0.136775302    192.168.1.2           192.168.1.1           TCP      66     53762 → 19 [ACK] Seq=1 Ack=153563 Win=1444 Len=0 TSval=1177857984 TSecr=3550878676
    201 0.139276466    192.168.1.2           192.168.1.1           TCP      66     53762 → 19 [ACK] Seq=1 Ack=156459 Win=1444 Len=0 TSval=1177857986 TSecr=3550878679
    204 0.141779862    192.168.1.2           192.168.1.1           TCP      66     53762 → 19 [ACK] Seq=1 Ack=159355 Win=1444 Len=0 TSval=1177857989 TSecr=3550878681
    207 0.144277987    192.168.1.2           192.168.1.1           TCP      66     53762 → 19 [ACK] Seq=1 Ack=162251 Win=1444 Len=0 TSval=1177857991 TSecr=3550878683
    210 0.146779573    192.168.1.2           192.168.1.1           TCP      66     53762 → 19 [ACK] Seq=1 Ack=165147 Win=1444 Len=0 TSval=1177857994 TSecr=3550878686
    213 0.149279565    192.168.1.2           192.168.1.1           TCP      66     53762 → 19 [ACK] Seq=1 Ack=168043 Win=1444 Len=0 TSval=1177857996 TSecr=3550878688
    216 0.151764015    192.168.1.2           192.168.1.1           TCP      66     53762 → 19 [ACK] Seq=1 Ack=170939 Win=1444 Len=0 TSval=1177857999 TSecr=3550878691
    219 0.154102421    192.168.1.2           192.168.1.1           TCP      66     53762 → 19 [ACK] Seq=1 Ack=173835 Win=1444 Len=0 TSval=1177858001 TSecr=3550878693
    222 0.156572566    192.168.1.2           192.168.1.1           TCP      66     53762 → 19 [ACK] Seq=1 Ack=176731 Win=1444 Len=0 TSval=1177858004 TSecr=3550878696
    225 0.159035352    192.168.1.2           192.168.1.1           TCP      66     53762 → 19 [ACK] Seq=1 Ack=179627 Win=1444 Len=0 TSval=1177858006 TSecr=3550878698
    228 0.161536373    192.168.1.2           192.168.1.1           TCP      66     53762 → 19 [ACK] Seq=1 Ack=182523 Win=1444 Len=0 TSval=1177858009 TSecr=3550878701
    231 0.164035366    192.168.1.2           192.168.1.1           TCP      66     53762 → 19 [ACK] Seq=1 Ack=185419 Win=1444 Len=0 TSval=1177858011 TSecr=3550878703
    234 0.166535635    192.168.1.2           192.168.1.1           TCP      66     53762 → 19 [ACK] Seq=1 Ack=188315 Win=1444 Len=0 TSval=1177858014 TSecr=3550878706
    237 0.169034890    192.168.1.2           192.168.1.1           TCP      66     53762 → 19 [ACK] Seq=1 Ack=191211 Win=1444 Len=0 TSval=1177858016 TSecr=3550878708
    240 0.171536085    192.168.1.2           192.168.1.1           TCP      66     53762 → 19 [ACK] Seq=1 Ack=194107 Win=1444 Len=0 TSval=1177858019 TSecr=3550878711
    243 0.173785024    192.168.1.2           192.168.1.1           TCP      66     53762 → 19 [ACK] Seq=1 Ack=197003 Win=1444 Len=0 TSval=1177858021 TSecr=3550878713
    246 0.176285589    192.168.1.2           192.168.1.1           TCP      66     53762 → 19 [ACK] Seq=1 Ack=199899 Win=1444 Len=0 TSval=1177858023 TSecr=3550878716
    249 0.178785152    192.168.1.2           192.168.1.1           TCP      66     53762 → 19 [ACK] Seq=1 Ack=202795 Win=1444 Len=0 TSval=1177858026 TSecr=3550878718
    252 0.181286022    192.168.1.2           192.168.1.1           TCP      66     53762 → 19 [ACK] Seq=1 Ack=205691 Win=1444 Len=0 TSval=1177858028 TSecr=3550878721
    255 0.183764125    192.168.1.2           192.168.1.1           TCP      66     53762 → 19 [ACK] Seq=1 Ack=208587 Win=1444 Len=0 TSval=1177858031 TSecr=3550878723
    258 0.186264538    192.168.1.2           192.168.1.1           TCP      66     53762 → 19 [ACK] Seq=1 Ack=211483 Win=1444 Len=0 TSval=1177858033 TSecr=3550878726
    261 0.188793111    192.168.1.2           192.168.1.1           TCP      66     53762 → 19 [ACK] Seq=1 Ack=214379 Win=1444 Len=0 TSval=1177858036 TSecr=3550878728
    264 0.191030626    192.168.1.2           192.168.1.1           TCP      66     53762 → 19 [ACK] Seq=1 Ack=217275 Win=1444 Len=0 TSval=1177858038 TSecr=3550878730
    267 0.193549851    192.168.1.2           192.168.1.1           TCP      66     53762 → 19 [ACK] Seq=1 Ack=220171 Win=1444 Len=0 TSval=1177858041 TSecr=3550878733
    270 0.196014476    192.168.1.2           192.168.1.1           TCP      66     53762 → 19 [ACK] Seq=1 Ack=223067 Win=1444 Len=0 TSval=1177858043 TSecr=3550878735
    273 0.198512997    192.168.1.2           192.168.1.1           TCP      66     53762 → 19 [ACK] Seq=1 Ack=225963 Win=1444 Len=0 TSval=1177858045 TSecr=3550878738
    276 0.201012508    192.168.1.2           192.168.1.1           TCP      66     53762 → 19 [ACK] Seq=1 Ack=228859 Win=1444 Len=0 TSval=1177858048 TSecr=3550878740
    279 0.203540682    192.168.1.2           192.168.1.1           TCP      66     53762 → 19 [ACK] Seq=1 Ack=231755 Win=1444 Len=0 TSval=1177858051 TSecr=3550878743
    282 0.206070019    192.168.1.2           192.168.1.1           TCP      66     53762 → 19 [ACK] Seq=1 Ack=234651 Win=1444 Len=0 TSval=1177858053 TSecr=3550878745
    285 0.208568571    192.168.1.2           192.168.1.1           TCP      66     53762 → 19 [ACK] Seq=1 Ack=237547 Win=1444 Len=0 TSval=1177858056 TSecr=3550878748
    288 0.210819755    192.168.1.2           192.168.1.1           TCP      66     53762 → 19 [ACK] Seq=1 Ack=240443 Win=1444 Len=0 TSval=1177858058 TSecr=3550878750
    291 0.213319517    192.168.1.2           192.168.1.1           TCP      66     53762 → 19 [ACK] Seq=1 Ack=243339 Win=1444 Len=0 TSval=1177858060 TSecr=3550878753
    294 0.215820127    192.168.1.2           192.168.1.1           TCP      66     53762 → 19 [ACK] Seq=1 Ack=246235 Win=1444 Len=0 TSval=1177858063 TSecr=3550878755
    297 0.218320396    192.168.1.2           192.168.1.1           TCP      66     53762 → 19 [ACK] Seq=1 Ack=249131 Win=1444 Len=0 TSval=1177858065 TSecr=3550878758
    300 0.220800314    192.168.1.2           192.168.1.1           TCP      66     53762 → 19 [ACK] Seq=1 Ack=252027 Win=1444 Len=0 TSval=1177858068 TSecr=3550878760
    303 0.223302242    192.168.1.2           192.168.1.1           TCP      66     53762 → 19 [ACK] Seq=1 Ack=254923 Win=1444 Len=0 TSval=1177858070 TSecr=3550878762
    306 0.225803257    192.168.1.2           192.168.1.1           TCP      66     53762 → 19 [ACK] Seq=1 Ack=257819 Win=1444 Len=0 TSval=1177858073 TSecr=3550878765
    309 0.228033829    192.168.1.2           192.168.1.1           TCP      66     53762 → 19 [ACK] Seq=1 Ack=260715 Win=1444 Len=0 TSval=1177858075 TSecr=3550878767
    312 0.230531542    192.168.1.2           192.168.1.1           TCP      66     53762 → 19 [ACK] Seq=1 Ack=263611 Win=1444 Len=0 TSval=1177858077 TSecr=3550878770
    315 0.233022315    192.168.1.2           192.168.1.1           TCP      66     53762 → 19 [ACK] Seq=1 Ack=266507 Win=1444 Len=0 TSval=1177858080 TSecr=3550878772
    318 0.235621597    192.168.1.2           192.168.1.1           TCP      66     53762 → 19 [ACK] Seq=1 Ack=269403 Win=1444 Len=0 TSval=1177858083 TSecr=3550878775
    321 0.238078627    192.168.1.2           192.168.1.1           TCP      66     53762 → 19 [ACK] Seq=1 Ack=272299 Win=1444 Len=0 TSval=1177858085 TSecr=3550878777
    324 0.240575889    192.168.1.2           192.168.1.1           TCP      66     53762 → 19 [ACK] Seq=1 Ack=275195 Win=1444 Len=0 TSval=1177858088 TSecr=3550878780
    327 0.243073303    192.168.1.2           192.168.1.1           TCP      66     53762 → 19 [ACK] Seq=1 Ack=278091 Win=1444 Len=0 TSval=1177858090 TSecr=3550878782
    330 0.245322964    192.168.1.2           192.168.1.1           TCP      66     53762 → 19 [ACK] Seq=1 Ack=280987 Win=1444 Len=0 TSval=1177858092 TSecr=3550878785
    333 0.247826084    192.168.1.2           192.168.1.1           TCP      66     53762 → 19 [ACK] Seq=1 Ack=283883 Win=1444 Len=0 TSval=1177858095 TSecr=3550878787
    336 0.250311153    192.168.1.2           192.168.1.1           TCP      66     53762 → 19 [ACK] Seq=1 Ack=286779 Win=1444 Len=0 TSval=1177858097 TSecr=3550878790
    339 0.252813499    192.168.1.2           192.168.1.1           TCP      66     53762 → 19 [ACK] Seq=1 Ack=289675 Win=1444 Len=0 TSval=1177858100 TSecr=3550878792
    342 0.255313058    192.168.1.2           192.168.1.1           TCP      66     53762 → 19 [ACK] Seq=1 Ack=292571 Win=1444 Len=0 TSval=1177858102 TSecr=3550878794
    345 0.257812801    192.168.1.2           192.168.1.1           TCP      66     53762 → 19 [ACK] Seq=1 Ack=295467 Win=1444 Len=0 TSval=1177858105 TSecr=3550878797
    348 0.260314258    192.168.1.2           192.168.1.1           TCP      66     53762 → 19 [ACK] Seq=1 Ack=298363 Win=1444 Len=0 TSval=1177858107 TSecr=3550878799
    351 0.262812545    192.168.1.2           192.168.1.1           TCP      66     53762 → 19 [ACK] Seq=1 Ack=301259 Win=1444 Len=0 TSval=1177858110 TSecr=3550878802
    354 0.265060154    192.168.1.2           192.168.1.1           TCP      66     53762 → 19 [ACK] Seq=1 Ack=304155 Win=1444 Len=0 TSval=1177858112 TSecr=3550878804
    357 0.267560307    192.168.1.2           192.168.1.1           TCP      66     53762 → 19 [ACK] Seq=1 Ack=307051 Win=1444 Len=0 TSval=1177858115 TSecr=3550878807
    360 0.270061657    192.168.1.2           192.168.1.1           TCP      66     53762 → 19 [ACK] Seq=1 Ack=309947 Win=1444 Len=0 TSval=1177858117 TSecr=3550878809
    363 0.272564174    192.168.1.2           192.168.1.1           TCP      66     53762 → 19 [ACK] Seq=1 Ack=312843 Win=1444 Len=0 TSval=1177858120 TSecr=3550878812
    366 0.275085020    192.168.1.2           192.168.1.1           TCP      66     53762 → 19 [ACK] Seq=1 Ack=315739 Win=1444 Len=0 TSval=1177858122 TSecr=3550878814
    369 0.277574611    192.168.1.2           192.168.1.1           TCP      66     53762 → 19 [ACK] Seq=1 Ack=318635 Win=1444 Len=0 TSval=1177858125 TSecr=3550878817
    372 0.280059072    192.168.1.2           192.168.1.1           TCP      66     53762 → 19 [ACK] Seq=1 Ack=321531 Win=1444 Len=0 TSval=1177858127 TSecr=3550878819
    375 0.282330595    192.168.1.2           192.168.1.1           TCP      66     53762 → 19 [ACK] Seq=1 Ack=324427 Win=1444 Len=0 TSval=1177858129 TSecr=3550878821
    378 0.284821601    192.168.1.2           192.168.1.1           TCP      66     53762 → 19 [ACK] Seq=1 Ack=327323 Win=1444 Len=0 TSval=1177858132 TSecr=3550878824
    381 0.287320977    192.168.1.2           192.168.1.1           TCP      66     53762 → 19 [ACK] Seq=1 Ack=330219 Win=1444 Len=0 TSval=1177858134 TSecr=3550878827
    384 0.289823156    192.168.1.2           192.168.1.1           TCP      66     53762 → 19 [ACK] Seq=1 Ack=333115 Win=1444 Len=0 TSval=1177858137 TSecr=3550878829
    387 0.292322809    192.168.1.2           192.168.1.1           TCP      66     53762 → 19 [ACK] Seq=1 Ack=336011 Win=1444 Len=0 TSval=1177858139 TSecr=3550878832
    390 0.294822705    192.168.1.2           192.168.1.1           TCP      66     53762 → 19 [ACK] Seq=1 Ack=338907 Win=1444 Len=0 TSval=1177858142 TSecr=3550878834
    393 0.297292708    192.168.1.2           192.168.1.1           TCP      66     53762 → 19 [ACK] Seq=1 Ack=341803 Win=1444 Len=0 TSval=1177858144 TSecr=3550878837
    396 0.299791502    192.168.1.2           192.168.1.1           TCP      66     53762 → 19 [ACK] Seq=1 Ack=344699 Win=1444 Len=0 TSval=1177858147 TSecr=3550878839
    399 0.302041699    192.168.1.2           192.168.1.1           TCP      66     53762 → 19 [ACK] Seq=1 Ack=347595 Win=1444 Len=0 TSval=1177858149 TSecr=3550878841
    402 0.304534443    192.168.1.2           192.168.1.1           TCP      66     53762 → 19 [ACK] Seq=1 Ack=350491 Win=1444 Len=0 TSval=1177858152 TSecr=3550878844
    405 0.307033240    192.168.1.2           192.168.1.1           TCP      66     53762 → 19 [ACK] Seq=1 Ack=353387 Win=1444 Len=0 TSval=1177858154 TSecr=3550878846
    408 0.309533652    192.168.1.2           192.168.1.1           TCP      66     53762 → 19 [ACK] Seq=1 Ack=356283 Win=1444 Len=0 TSval=1177858157 TSecr=3550878849
    411 0.312035787    192.168.1.2           192.168.1.1           TCP      66     53762 → 19 [ACK] Seq=1 Ack=359179 Win=1444 Len=0 TSval=1177858159 TSecr=3550878851
    414 0.314534348    192.168.1.2           192.168.1.1           TCP      66     53762 → 19 [ACK] Seq=1 Ack=362075 Win=1444 Len=0 TSval=1177858162 TSecr=3550878854
    417 0.317039573    192.168.1.2           192.168.1.1           TCP      66     53762 → 19 [ACK] Seq=1 Ack=364971 Win=1444 Len=0 TSval=1177858164 TSecr=3550878856
    420 0.319296895    192.168.1.2           192.168.1.1           TCP      66     53762 → 19 [ACK] Seq=1 Ack=367867 Win=1444 Len=0 TSval=1177858166 TSecr=3550878859
    423 0.321810353    192.168.1.2           192.168.1.1           TCP      66     53762 → 19 [ACK] Seq=1 Ack=370763 Win=1444 Len=0 TSval=1177858169 TSecr=3550878861
    426 0.324315847    192.168.1.2           192.168.1.1           TCP      66     53762 → 19 [ACK] Seq=1 Ack=373659 Win=1444 Len=0 TSval=1177858171 TSecr=3550878864
    429 0.326838492    192.168.1.2           192.168.1.1           TCP      66     53762 → 19 [ACK] Seq=1 Ack=376555 Win=1444 Len=0 TSval=1177858174 TSecr=3550878866
    432 0.329331440    192.168.1.2           192.168.1.1           TCP      66     53762 → 19 [ACK] Seq=1 Ack=379451 Win=1444 Len=0 TSval=1177858176 TSecr=3550878869
    435 0.331830414    192.168.1.2           192.168.1.1           TCP      66     53762 → 19 [ACK] Seq=1 Ack=382347 Win=1444 Len=0 TSval=1177858179 TSecr=3550878871
    438 0.334348309    192.168.1.2           192.168.1.1           TCP      66     53762 → 19 [ACK] Seq=1 Ack=385243 Win=1444 Len=0 TSval=1177858181 TSecr=3550878873
    441 0.336581705    192.168.1.2           192.168.1.1           TCP      66     53762 → 19 [ACK] Seq=1 Ack=388139 Win=1444 Len=0 TSval=1177858184 TSecr=3550878876
    444 0.339080405    192.168.1.2           192.168.1.1           TCP      66     53762 → 19 [ACK] Seq=1 Ack=391035 Win=1444 Len=0 TSval=1177858186 TSecr=3550878878
    447 0.341534329    192.168.1.2           192.168.1.1           TCP      66     53762 → 19 [ACK] Seq=1 Ack=393931 Win=1444 Len=0 TSval=1177858189 TSecr=3550878881
    450 0.344045015    192.168.1.2           192.168.1.1           TCP      66     53762 → 19 [ACK] Seq=1 Ack=396827 Win=1444 Len=0 TSval=1177858191 TSecr=3550878883
    453 0.346562687    192.168.1.2           192.168.1.1           TCP      66     53762 → 19 [ACK] Seq=1 Ack=399723 Win=1444 Len=0 TSval=1177858194 TSecr=3550878886
    456 0.349093086    192.168.1.2           192.168.1.1           TCP      66     53762 → 19 [ACK] Seq=1 Ack=402619 Win=1444 Len=0 TSval=1177858196 TSecr=3550878888
    459 0.351543772    192.168.1.2           192.168.1.1           TCP      66     53762 → 19 [ACK] Seq=1 Ack=405515 Win=1444 Len=0 TSval=1177858199 TSecr=3550878891
    462 0.354040591    192.168.1.2           192.168.1.1           TCP      66     53762 → 19 [ACK] Seq=1 Ack=408411 Win=1444 Len=0 TSval=1177858201 TSecr=3550878893
    465 0.356289346    192.168.1.2           192.168.1.1           TCP      66     53762 → 19 [ACK] Seq=1 Ack=411307 Win=1444 Len=0 TSval=1177858203 TSecr=3550878896
    468 0.358805038    192.168.1.2           192.168.1.1           TCP      66     53762 → 19 [ACK] Seq=1 Ack=414203 Win=1444 Len=0 TSval=1177858206 TSecr=3550878898
    471 0.361350047    192.168.1.2           192.168.1.1           TCP      66     53762 → 19 [ACK] Seq=1 Ack=417099 Win=1444 Len=0 TSval=1177858208 TSecr=3550878900
    474 0.363908271    192.168.1.2           192.168.1.1           TCP      66     53762 → 19 [ACK] Seq=1 Ack=419995 Win=1444 Len=0 TSval=1177858211 TSecr=3550878903
    477 0.366331947    192.168.1.2           192.168.1.1           TCP      66     53762 → 19 [ACK] Seq=1 Ack=422891 Win=1444 Len=0 TSval=1177858213 TSecr=3550878905
    480 0.368799529    192.168.1.2           192.168.1.1           TCP      66     53762 → 19 [ACK] Seq=1 Ack=425787 Win=1444 Len=0 TSval=1177858216 TSecr=3550878908
    483 0.371299367    192.168.1.2           192.168.1.1           TCP      66     53762 → 19 [ACK] Seq=1 Ack=428683 Win=1444 Len=0 TSval=1177858218 TSecr=3550878911
    486 0.373570661    192.168.1.2           192.168.1.1           TCP      66     53762 → 19 [ACK] Seq=1 Ack=431579 Win=1444 Len=0 TSval=1177858221 TSecr=3550878913
    489 0.376053973    192.168.1.2           192.168.1.1           TCP      66     53762 → 19 [ACK] Seq=1 Ack=434475 Win=1444 Len=0 TSval=1177858223 TSecr=3550878915
    492 0.378547448    192.168.1.2           192.168.1.1           TCP      66     53762 → 19 [ACK] Seq=1 Ack=437371 Win=1444 Len=0 TSval=1177858226 TSecr=3550878918
    495 0.381153693    192.168.1.2           192.168.1.1           TCP      66     53762 → 19 [ACK] Seq=1 Ack=440267 Win=1444 Len=0 TSval=1177858228 TSecr=3550878920
    498 0.383564792    192.168.1.2           192.168.1.1           TCP      66     53762 → 19 [ACK] Seq=1 Ack=443163 Win=1444 Len=0 TSval=1177858231 TSecr=3550878923
    501 0.386061615    192.168.1.2           192.168.1.1           TCP      66     53762 → 19 [ACK] Seq=1 Ack=446059 Win=1444 Len=0 TSval=1177858233 TSecr=3550878925
    504 0.388563271    192.168.1.2           192.168.1.1           TCP      66     53762 → 19 [ACK] Seq=1 Ack=448955 Win=1444 Len=0 TSval=1177858236 TSecr=3550878928
    507 0.390814079    192.168.1.2           192.168.1.1           TCP      66     53762 → 19 [ACK] Seq=1 Ack=451851 Win=1444 Len=0 TSval=1177858238 TSecr=3550878930
    510 0.393319803    192.168.1.2           192.168.1.1           TCP      66     53762 → 19 [ACK] Seq=1 Ack=454747 Win=1444 Len=0 TSval=1177858240 TSecr=3550878933
    513 0.395851520    192.168.1.2           192.168.1.1           TCP      66     53762 → 19 [ACK] Seq=1 Ack=457643 Win=1444 Len=0 TSval=1177858243 TSecr=3550878935
    516 0.398321538    192.168.1.2           192.168.1.1           TCP      66     53762 → 19 [ACK] Seq=1 Ack=460539 Win=1444 Len=0 TSval=1177858245 TSecr=3550878938
    519 0.400820996    192.168.1.2           192.168.1.1           TCP      66     53762 → 19 [ACK] Seq=1 Ack=463435 Win=1444 Len=0 TSval=1177858248 TSecr=3550878940
    522 0.403317391    192.168.1.2           192.168.1.1           TCP      66     53762 → 19 [ACK] Seq=1 Ack=466331 Win=1444 Len=0 TSval=1177858250 TSecr=3550878943
    525 0.405802219    192.168.1.2           192.168.1.1           TCP      66     53762 → 19 [ACK] Seq=1 Ack=469227 Win=1444 Len=0 TSval=1177858253 TSecr=3550878945
    528 0.408071575    192.168.1.2           192.168.1.1           TCP      66     53762 → 19 [ACK] Seq=1 Ack=472123 Win=1444 Len=0 TSval=1177858255 TSecr=3550878947
    531 0.410569673    192.168.1.2           192.168.1.1           TCP      66     53762 → 19 [ACK] Seq=1 Ack=475019 Win=1444 Len=0 TSval=1177858258 TSecr=3550878950
    534 0.413099080    192.168.1.2           192.168.1.1           TCP      66     53762 → 19 [ACK] Seq=1 Ack=477915 Win=1444 Len=0 TSval=1177858260 TSecr=3550878952
    537 0.415554847    192.168.1.2           192.168.1.1           TCP      66     53762 → 19 [ACK] Seq=1 Ack=480811 Win=1444 Len=0 TSval=1177858263 TSecr=3550878955
    540 0.418071462    192.168.1.2           192.168.1.1           TCP      66     53762 → 19 [ACK] Seq=1 Ack=483707 Win=1444 Len=0 TSval=1177858265 TSecr=3550878957
    543 0.420572370    192.168.1.2           192.168.1.1           TCP      66     53762 → 19 [ACK] Seq=1 Ack=486603 Win=1444 Len=0 TSval=1177858268 TSecr=3550878960
    546 0.423072523    192.168.1.2           192.168.1.1           TCP      66     53762 → 19 [ACK] Seq=1 Ack=489499 Win=1444 Len=0 TSval=1177858270 TSecr=3550878962
    549 0.425573450    192.168.1.2           192.168.1.1           TCP      66     53762 → 19 [ACK] Seq=1 Ack=492395 Win=1444 Len=0 TSval=1177858273 TSecr=3550878965
    552 0.427806427    192.168.1.2           192.168.1.1           TCP      66     53762 → 19 [ACK] Seq=1 Ack=495291 Win=1444 Len=0 TSval=1177858275 TSecr=3550878967
    555 0.430314738    192.168.1.2           192.168.1.1           TCP      66     53762 → 19 [ACK] Seq=1 Ack=498187 Win=1444 Len=0 TSval=1177858277 TSecr=3550878970
    558 0.432927875    192.168.1.2           192.168.1.1           TCP      66     53762 → 19 [ACK] Seq=1 Ack=501083 Win=1444 Len=0 TSval=1177858280 TSecr=3550878972
    561 0.435363967    192.168.1.2           192.168.1.1           TCP      66     53762 → 19 [ACK] Seq=1 Ack=503979 Win=1444 Len=0 TSval=1177858282 TSecr=3550878975
    564 0.437828623    192.168.1.2           192.168.1.1           TCP      66     53762 → 19 [ACK] Seq=1 Ack=506875 Win=1444 Len=0 TSval=1177858285 TSecr=3550878977
    567 0.440328761    192.168.1.2           192.168.1.1           TCP      66     53762 → 19 [ACK] Seq=1 Ack=509771 Win=1444 Len=0 TSval=1177858287 TSecr=3550878979
    570 0.442828528    192.168.1.2           192.168.1.1           TCP      66     53762 → 19 [ACK] Seq=1 Ack=512667 Win=1444 Len=0 TSval=1177858290 TSecr=3550878982
    573 0.445078111    192.168.1.2           192.168.1.1           TCP      66     53762 → 19 [ACK] Seq=1 Ack=515563 Win=1444 Len=0 TSval=1177858292 TSecr=3550878984
    576 0.447581592    192.168.1.2           192.168.1.1           TCP      66     53762 → 19 [ACK] Seq=1 Ack=518459 Win=1444 Len=0 TSval=1177858295 TSecr=3550878987
    579 0.450078933    192.168.1.2           192.168.1.1           TCP      66     53762 → 19 [ACK] Seq=1 Ack=521355 Win=1444 Len=0 TSval=1177858297 TSecr=3550878989
    582 0.452589099    192.168.1.2           192.168.1.1           TCP      66     53762 → 19 [ACK] Seq=1 Ack=524251 Win=1444 Len=0 TSval=1177858300 TSecr=3550878992
    585 0.455088429    192.168.1.2           192.168.1.1           TCP      66     53762 → 19 [ACK] Seq=1 Ack=527147 Win=1444 Len=0 TSval=1177858302 TSecr=3550878994
    588 0.457589522    192.168.1.2           192.168.1.1           TCP      66     53762 → 19 [ACK] Seq=1 Ack=530043 Win=1444 Len=0 TSval=1177858305 TSecr=3550878997
    591 0.460082241    192.168.1.2           192.168.1.1           TCP      66     53762 → 19 [ACK] Seq=1 Ack=532939 Win=1444 Len=0 TSval=1177858307 TSecr=3550878999
    594 0.462348227    192.168.1.2           192.168.1.1           TCP      66     53762 → 19 [ACK] Seq=1 Ack=535835 Win=1444 Len=0 TSval=1177858309 TSecr=3550879002
    597 0.464841560    192.168.1.2           192.168.1.1           TCP      66     53762 → 19 [ACK] Seq=1 Ack=538731 Win=1444 Len=0 TSval=1177858312 TSecr=3550879004
    600 0.467389549    192.168.1.2           192.168.1.1           TCP      66     53762 → 19 [ACK] Seq=1 Ack=541627 Win=1444 Len=0 TSval=1177858314 TSecr=3550879007
    603 0.469849048    192.168.1.2           192.168.1.1           TCP      66     53762 → 19 [ACK] Seq=1 Ack=544523 Win=1444 Len=0 TSval=1177858317 TSecr=3550879009
    606 0.472363198    192.168.1.2           192.168.1.1           TCP      66     53762 → 19 [ACK] Seq=1 Ack=547419 Win=1444 Len=0 TSval=1177858319 TSecr=3550879011
    609 0.474837182    192.168.1.2           192.168.1.1           TCP      66     53762 → 19 [ACK] Seq=1 Ack=550315 Win=1444 Len=0 TSval=1177858322 TSecr=3550879014
    612 0.477337088    192.168.1.2           192.168.1.1           TCP      66     53762 → 19 [ACK] Seq=1 Ack=553211 Win=1444 Len=0 TSval=1177858324 TSecr=3550879017
    615 0.479837274    192.168.1.2           192.168.1.1           TCP      66     53762 → 19 [ACK] Seq=1 Ack=556107 Win=1444 Len=0 TSval=1177858327 TSecr=3550879019
    618 0.482086954    192.168.1.2           192.168.1.1           TCP      66     53762 → 19 [ACK] Seq=1 Ack=559003 Win=1444 Len=0 TSval=1177858329 TSecr=3550879022
    621 0.484587502    192.168.1.2           192.168.1.1           TCP      66     53762 → 19 [ACK] Seq=1 Ack=561899 Win=1444 Len=0 TSval=1177858332 TSecr=3550879024
    624 0.487090309    192.168.1.2           192.168.1.1           TCP      66     53762 → 19 [ACK] Seq=1 Ack=564795 Win=1444 Len=0 TSval=1177858334 TSecr=3550879026
    627 0.489587437    192.168.1.2           192.168.1.1           TCP      66     53762 → 19 [ACK] Seq=1 Ack=567691 Win=1444 Len=0 TSval=1177858337 TSecr=3550879029
    630 0.492088446    192.168.1.2           192.168.1.1           TCP      66     53762 → 19 [ACK] Seq=1 Ack=570587 Win=1444 Len=0 TSval=1177858339 TSecr=3550879031
    633 0.494589315    192.168.1.2           192.168.1.1           TCP      66     53762 → 19 [ACK] Seq=1 Ack=573483 Win=1444 Len=0 TSval=1177858342 TSecr=3550879034
    636 0.497088976    192.168.1.2           192.168.1.1           TCP      66     53762 → 19 [ACK] Seq=1 Ack=576379 Win=1444 Len=0 TSval=1177858344 TSecr=3550879036
    639 0.499323352    192.168.1.2           192.168.1.1           TCP      66     53762 → 19 [ACK] Seq=1 Ack=579275 Win=1444 Len=0 TSval=1177858346 TSecr=3550879039
    642 0.501833161    192.168.1.2           192.168.1.1           TCP      66     53762 → 19 [ACK] Seq=1 Ack=582171 Win=1444 Len=0 TSval=1177858349 TSecr=3550879041
    645 0.504363347    192.168.1.2           192.168.1.1           TCP      66     53762 → 19 [ACK] Seq=1 Ack=585067 Win=1444 Len=0 TSval=1177858351 TSecr=3550879044
    648 0.506885019    192.168.1.2           192.168.1.1           TCP      66     53762 → 19 [ACK] Seq=1 Ack=587963 Win=1444 Len=0 TSval=1177858354 TSecr=3550879046
    651 0.509346517    192.168.1.2           192.168.1.1           TCP      66     53762 → 19 [ACK] Seq=1 Ack=590859 Win=1444 Len=0 TSval=1177858356 TSecr=3550879049
